id,title,media_type,original_title,release_date,year,format,genre,director,rating,user_rating,tmdb_id,tmdb_media_type,tmdb_url,poster_path,backdrop_path,overview,trailer_url,runtime,upc,location,notes,season_number,episode_number,episode_title,network,type_details,series_id,space_id,library_id,import_source,added_by,created_at,updated_at,signed_by,signed_role,signed_on,signed_at,signed_proof_path,cast_members,owned_formats,estimated_value_low,estimated_value_mid,estimated_value_high,valuation_currency,valuation_source,valuation_last_updated,tv_season_count,tv_completed_season_count,tv_all_seasons_completed,cast
250,Gun,game,Gun - PlayStation 2,2021-08-05T00:00:00.000Z,2020,Digital,Indie,ACTIVISION,,,,movie,https://www.igdb.com/games/gun-gun-create,https://images.igdb.com/igdb/image/upload/t_cover_big/co41iu.jpg,,プレイヤーは店の店主となって依頼者の様々な要望に応えます。 依頼者と会話を進めていく中で、何が必要か、どんな状況かを推理し、 それに合った銃をカスタマイズしていきます。,,,,,Edition: Standard | Platform: PlayStation 2,,,,,"{""platform"":""PlayStation 2""}",,1,7,csv_delicious,1,2026-03-08T04:41:52.822Z,2026-04-12T17:43:25.385Z,,,,,,,"[""digital""]",,,,,,,0,0,false,
421,Gungrave Overdose,game,,2004-04-04T00:00:00.000Z,2020,Digital,Shooter,Codemasters,,,,movie,https://www.igdb.com/games/gungrave-overdose,https://images.igdb.com/igdb/image/upload/t_cover_big/co6il2.jpg,,"Three years after the events that took place in the original Gungrave, the Corsione family has unleashed the deadly drug SEED upon the populace. Now it's up to Grave, Spike and Mika to follow the trail of SEED back to its source and eradicate it once and for all.

Much like its predecessor, Gungrave: Overdose offers up several action-packed levels that simply don't allow the player to let up on the fire button. This sequel ups the ante with even larger hordes of enemies to blast through along with a slew of destructible environments to wreak havoc in. Along the way, Grave will team up with newcomers Juji and Billy. Juji fights using a unique combination of close-range guns and swordplay, while Billy defeats his enemies with the sheer power of his electric guitar.",,,,,Platform: PlayStation 2,,,,,"{""platform"":""PlayStation 2"",""developer"":""Red Entertainment""}",,1,7,csv_delicious,1,2026-03-08T04:45:02.029Z,2026-04-12T17:46:34.134Z,,,,,,,"[""digital""]",,,,,,,0,0,false,
862,Gyromite,game,,1985-08-13T00:00:00.000Z,2015,Digital,"Platform, Puzzle, Strategy",Nintendo,,,,movie,https://www.igdb.com/games/gyromite,https://images.igdb.com/igdb/image/upload/t_cover_big/co42tm.jpg,,"Gyromite is a video game released in 1985 for the Nintendo Entertainment System, designed for use with the Robotic Operating Buddy (R.O.B.). Gyromite is one of two games in Nintendo's Robot Series, the other being Stack-Up",,,0045496630010,,Edition: Standard,,,,,"{""platform"":""Family Computer, Nintendo Entertainment System"",""developer"":""Nintendo R&D1""}",,1,7,csv_delicious,1,2026-03-08T04:52:23.545Z,2026-04-06T06:35:42.527Z,,,,,,,"[""digital""]",,,,,,,0,0,false,
863,Gyruss,game,,,2014,Digital,Shooter,Nintendo,,,,movie,https://www.igdb.com/games/gyruss--9,https://images.igdb.com/igdb/image/upload/t_cover_big/co9tdt.jpg,,"Parker Brothers released contemporary ports for the Atari 2600, Atari 5200, Atari 8-bit computers, ColecoVision, and Commodore 64. A version for the ZX Spectrum was coded but never released.",,,,,,,,,,"{""platform"":""ZX Spectrum"",""developer"":""Konami""}",,1,7,csv_delicious,1,2026-03-08T04:52:24.538Z,2026-04-06T06:35:42.527Z,,,,,,,"[""digital""]",,,,,,,0,0,false,
997,Hades,game,Hades - PlayStation 4,2020-09-17T00:00:00.000Z,2021,Digital,"Role-playing (RPG), Hack and slash/Beat 'em up, Adventure, Indie",Private Division,,,,movie,https://www.igdb.com/games/hades--1,https://images.igdb.com/igdb/image/upload/t_cover_big/cob9kr.jpg,,"A rogue-lite hack and slash dungeon crawler in which Zagreus, son of Hades the Greek god of the dead, attempts to escape his home and his oppressive father by fighting the souls of the dead through the various layers of the ever-shifting underworld, while getting to know and forging relationships with its inhabitants.",,,0710425577888,,Platform: PlayStation 4,,,,,"{""platform"":""PlayStation 4"",""developer"":""Supergiant Games""}",,1,7,csv_delicious,1,2026-03-08T04:54:57.996Z,2026-04-06T06:35:42.527Z,,,,,,,"[""digital""]",,,,,,,0,0,false,
503,Half Life 2,game,Half Life 2 - Xbox,2006-06-15T00:00:00.000Z,2006,Digital,Shooter,Electronic Arts,,,,movie,https://www.igdb.com/games/half-life-2,https://images.igdb.com/igdb/image/upload/t_cover_big/co1nmw.jpg,,"1998. HALF-LIFE sends a shock through the game industry with its combination of pounding action and continuous, immersive storytelling.

NOW. By taking the suspense, challenge and visceral charge of the original, and adding startling new realism and responsiveness, Half-Life 2 opens the door to a world where the player's presence affects everything around them, from the physical environment to the behaviors even the emotions of both friends and enemies.",,,0014633151596,,Edition: Standard | Platform: Xbox,,,,,"{""platform"":""Xbox"",""developer"":""Valve""}",,1,7,csv_delicious,1,2026-03-08T04:46:26.406Z,2026-04-12T17:47:58.788Z,,,,,,,"[""digital""]",,,,,,,0,0,false,
1325,Half-Life - PlayStation 2,game,,1998-11-19T00:00:00.000Z,2014,Digital,"Shooter, Puzzle, Adventure",Valve,,,,movie,https://www.igdb.com/games/half-life,https://images.igdb.com/igdb/image/upload/t_cover_big/coag8n.jpg,,"Dr. Gordon Freeman doesn't speak, but he's got a helluva story to tell. This first-person roller-coaster initiated a new era in the history of action games by combining engrossing gameplay, upgraded graphics, ingenious level design and a revolutionary story that may not be all that it seems, told not through cutscenes, but through the visual environment.",,,0783651863889,,Edition: Standard,,,,,"{""platform"":""Linux, PC (Microsoft Windows), Mac, PlayStation 2"",""developer"":""Sierra Entertainment""}",,1,7,csv_delicious,1,2026-03-08T05:00:48.276Z,2026-04-06T06:35:42.527Z,,,,,,,"[""digital""]",,,,,,,0,0,false,
757,Halo 2,game,Halo 2 - Xbox,2004-11-09T00:00:00.000Z,2004,Digital,Shooter,Microsoft,,,,movie,https://www.igdb.com/games/halo-2,https://images.igdb.com/igdb/image/upload/t_cover_big/co1x77.jpg,,"Halo 2 is the sequel to the highly successful and critically acclaimed Halo: Combat Evolved. In Halo 2, the saga continues as Master Chief—a genetically enhanced super-soldier—is the only thing standing between the relentless Covenant and the destruction of all humankind.",,,0805529792234,,Edition: Standard | Platform: Xbox,,,,,"{""platform"":""Xbox"",""developer"":""Bungie""}",,1,7,csv_delicious,1,2026-03-08T04:50:25.677Z,2026-04-06T06:35:42.527Z,,,,,,,"[""digital""]",,,,,,,0,0,false,
758,Halo 2 Multiplayer Map Pack,game,Halo 2 Multiplayer Map Pack - Xbox,2006-06-15T00:00:00.000Z,2006,Digital,Shooter,Microsoft,,,,movie,https://www.igdb.com/games/halo-2-multiplayer-map-pack,https://images.igdb.com/igdb/image/upload/t_cover_big/co753s.jpg,,"This pack is an add-on for Halo 2 with a collection of multiplayer maps for gamers who do not have access to Xbox Live. It contains 9 new maps (Containment, Warlock, Turf, Sanctuary, Gemini, Relic, Elongation, Terminal and Backwash), an auto update that brings the game to the latest version, with cheating countermeasures, and all prior Live updates.",,,0882224024259,,Edition: Standard | Platform: Xbox,,,,,"{""platform"":""Xbox"",""developer"":""Microsoft Game Studios""}",,1,7,csv_delicious,1,2026-03-08T04:50:27.880Z,2026-04-06T06:35:42.527Z,,,,,,,"[""digital""]",,,,,,,0,0,false,
1414,Halo 3 \u2013 Xbox 360,game,,2007-09-25T00:00:00.000Z,2007,Digital,,Xbox,,,,movie,,,,,,,0014445571735,,Edition: Standard | Platform: Xbox 360,,,,,"{""platform"":""Xbox 360""}",,1,7,csv_delicious,1,2026-03-08T05:02:27.607Z,2026-04-06T06:35:42.527Z,,,,,,,"[""digital""]",,,,,,,0,0,false,
759,Halo 4,game,Halo 4 - Xbox 360,2012-11-06T00:00:00.000Z,2012,Digital,Shooter,Microsoft,,,,movie,https://www.igdb.com/games/halo-4,https://images.igdb.com/igdb/image/upload/t_cover_big/co1xhf.jpg,,"Halo 4 marks the start of an epic new saga within the award-winning Halo universe. The Master Chief returns in this award-winning first-person shooter developed by 343 Industries. Shipwrecked on a mysterious world, faced with new enemies and deadly technology, the Chief returns to battle against an ancient evil bent on vengeance and annihilation...the universe will never be the same.",,,0080050316412,,Edition: Standard Game | Platform: Xbox 360,,,,,"{""platform"":""Xbox 360"",""developer"":""343 Industries""}",,1,7,csv_delicious,1,2026-03-08T04:50:28.873Z,2026-04-06T06:35:42.527Z,,,,,,,"[""digital""]",,,,,,,0,0,false,
1415,Halo 5: Guardians \u2013 Xbox One,game,,2015-10-27T00:00:00.000Z,2023,Digital,Shooter,Xbox,,,,movie,https://www.igdb.com/games/halo-5-guardians,https://images.igdb.com/igdb/image/upload/t_cover_big/co1xhg.jpg,,"Halo 5: Guardians delivers epic multiplayer experiences that span multiple modes, full-featured level building tools, and another chapter in the Master Chief saga. The Master Chief saga continues, with solo and up to 4-player cooperative experience that spans three worlds. A mysterious and unstoppable force threatens the galaxy. The Spartans of Fireteam Osiris and Blue Team must embark on a journey that will change the course of history and the future of mankind.",,,0885370928518,,Edition: Standard,,,,,"{""platform"":""Xbox One"",""developer"":""Microsoft Studios""}",,1,7,csv_delicious,1,2026-03-08T05:02:29.823Z,2026-04-06T06:35:42.527Z,,,,,,,"[""digital""]",,,,,,,0,0,false,
760,Halo Combat Evolved,game,,2001-11-15T00:00:00.000Z,2018,Digital,Shooter,Microsoft,,,,movie,https://www.igdb.com/games/halo-combat-evolved,https://images.igdb.com/igdb/image/upload/t_cover_big/co2r2r.jpg,,"Bent on Humankind's extermination, a powerful fellowship of alien races known as the Covenant is wiping out Earth's fledgling interstellar empire. Climb into the boots of Master Chief, a biologically altered super-soldier, as you and the other surviving defenders of a devastated colony-world make a desperate attempt to lure the alien fleet away from earth. Shot down and marooned on the ancient ring-world Halo, you begin a guerilla-war against the Covenant. Fight for humanity against an alien onslaught as you race to uncover the mysteries of Halo.",,,0659556745165,,Platform: Xbox,,,,,"{""platform"":""Xbox"",""developer"":""Microsoft Game Studios""}",,1,7,csv_delicious,1,2026-03-08T04:50:30.089Z,2026-04-06T06:35:42.527Z,,,,,,,"[""digital""]",,,,,,,0,0,false,
761,Halo ODST,game,Halo ODST - Xbox 360,2009-09-22T00:00:00.000Z,2021,Digital,Shooter,Microsoft,,,,movie,https://www.igdb.com/games/halo-3-odst,https://images.igdb.com/igdb/image/upload/t_cover_big/co1xhh.jpg,,"New Mombasa is in ruins, yet the fight is far from over. Halo 3: ODST drops players onto the streets of the besieged city in this first-person shooter. Assume the role of “The Rookie”, an Orbital Drop Shock Trooper, and discover the truth behind the Covenant invasion. Engage in intense online multiplayer battles with the complete collection of Halo 3 multiplayer maps – including three all-new battlefields – and join your teammates in Firefight, a new cooperative mode that pits you against waves of Covenant invaders.",,,,,Edition: Standard | Platform: Xbox 360,,,,,"{""platform"":""Xbox 360"",""developer"":""Microsoft Game Studios""}",,1,7,csv_delicious,1,2026-03-08T04:50:33.415Z,2026-04-06T06:35:42.527Z,,,,,,,"[""digital""]",,,,,,,0,0,false,
762,Halo Reach,game,,2010-09-21T00:00:00.000Z,2010,Digital,Shooter,Microsoft,,,,movie,https://www.igdb.com/games/halo-reach,https://images.igdb.com/igdb/image/upload/t_cover_big/co1xha.jpg,,"Experience the story before the events of Halo: Combat Evolved as you fight to defend the planet Reach from a harrowing Covenant invasion. In this first-person shooter you can customize your own Spartan with armor and accessories to experience both a pulse-pounding campaign and addictive multiplayer mode. Reach will fall, but it won't go down without a fight.",,,0000016698512,,Edition: Standard | Platform: Xbox 360,,,,,"{""platform"":""Xbox 360"",""developer"":""Bungie""}",,1,7,csv_delicious,1,2026-03-08T04:50:34.520Z,2026-04-06T06:35:42.527Z,,,,,,,"[""digital""]",,,,,,,0,0,false,
763,Halo: Combat Evolved Anniversary,game,,2012-01-24T00:00:00.000Z,2012,Digital,Shooter,Microsoft,,,,movie,https://www.igdb.com/games/halo-combat-evolved-anniversary,https://images.igdb.com/igdb/image/upload/t_cover_big/co1xhb.jpg,,"Halo: Combat Evolved Anniversary is a spectacular remastered version of the original game, created to celebrate the 10th anniversary of one of the most beloved first-person shooters in gaming history. Bundled with seven of the most popular multiplayer maps in Halo history ready for Xbox Live, Halo: Anniversary includes a bounty of new features including cooperative play over Xbox Live, Achievements, new challenges, and new fiction to uncover.",,,0151903033593,,Edition: Standard | Platform: Xbox 360,,,,,"{""platform"":""Xbox 360"",""developer"":""Microsoft Studios""}",,1,7,csv_delicious,1,2026-03-08T04:50:35.498Z,2026-04-06T06:35:42.527Z,,,,,,,"[""digital""]",,,,,,,0,0,false,
1157,Heavy Rain,game,,2010-02-18T00:00:00.000Z,2020,Digital,Adventure,Sony,,,,movie,https://www.igdb.com/games/heavy-rain,https://images.igdb.com/igdb/image/upload/t_cover_big/coaajv.jpg,,"Heavy Rain is a cinematic psychological thriller from game developer Quantic Dream exclusively for the PlayStation 3. Dealing with a range of adult themes, the game revolves around a sophisticated plot and strong narrative threads that explore a complex moral proposition. You assume the role of multiple characters with very different backgrounds, motivations, and skills in a world where each player decision affects what will follow.",,,,,Edition: Standard,,,,,"{""platform"":""PlayStation 3, PlayStation 4, PC (Microsoft Windows)"",""developer"":""Quantic Dream""}",,1,7,csv_delicious,1,2026-03-08T04:57:46.151Z,2026-04-06T06:35:42.527Z,,,,,,,"[""digital""]",,,,,,,0,0,false,
955,Helldivers 2,game,Helldivers 2 - PlayStation 5,2024-02-08T00:00:00.000Z,2024,Digital,"Shooter, Tactical",PlayStation,,,,movie,https://www.igdb.com/games/helldivers-2,https://images.igdb.com/igdb/image/upload/t_cover_big/coabbf.jpg,,"The Galaxy’s Last Line of Offence. Enlist in the Helldivers and join the fight for freedom across a hostile galaxy in a fast, frantic, and ferocious third-person shooter.",,,0711719568124,,Edition: Standard | Platform: PlayStation 5,,,,,"{""platform"":""PlayStation 5"",""developer"":""Arrowhead Game Studios""}",,1,7,csv_delicious,1,2026-03-08T04:54:07.981Z,2026-04-06T06:35:42.527Z,,,,,,,"[""digital""]",,,,,,,0,0,false,
607,Hexen,game,,1997-04-30T00:00:00.000Z,2015,Digital,Shooter,Hexen for Playstation by GT Interactive,,,,movie,https://www.igdb.com/games/hexen--1,https://images.igdb.com/igdb/image/upload/t_cover_big/co53i9.jpg,,"The Sega Saturn version inherits most of the restrictions of the PlayStation version, such as the simplified scenery architecture and the downgraded lighting, although it does feature improvements in certain aspects.

The scripting is faster, and the frame rate, while not fluid or consistent, is slightly better. The enemies still have all but their front sprites missing, but they retain their gory deaths when killed by a strong hit or weapon.

This version also has hidden two-player link-up cooperative and deathmatch modes, accessible only through the unlockable cheat menu. While this port shares the FMV scenes and most of the Redbook audio music from the other CD-ROM versions, it also includes some new music tracks.",,,,,Edition: Standard | Platform: PlayStation,,,,,"{""platform"":""PlayStation"",""developer"":""GameBank""}",,1,7,csv_delicious,1,2026-03-08T04:48:03.541Z,2026-04-06T06:35:42.527Z,,,,,,,"[""digital""]",,,,,,,0,0,false,
591,Hexen: Beyond Heretic,game,,1995-10-30T00:00:00.000Z,2017,Digital,"Shooter, Puzzle, Role-playing (RPG)",GT Interactive,,,,movie,https://www.igdb.com/games/hexen-beyond-heretic,https://images.igdb.com/igdb/image/upload/t_cover_big/co1mwy.jpg,,"While you were battling the evil forces of D'Sparil, the other Serpent Riders were busy sowing the seeds of destruction in other dimensions. One such dimension is the decaying world where Hexen takes place. A world littered with the mangled corpses of nonbelievers and inhabited by the undead followers that executed them. Only three humans; a warrior, a mage and a cleric; have escaped the leaders' vicious spell. Now these brave souls have sworn to crush the evil regime that threatens to destroy the world forever. Separated upon entering the mystical portal, the three are forced to attempt on their own what they had hoped to do together: find Korax's stronghold, destroy him and restore order in the physical world.

Become one of 3 heroes. Wield superhuman powers and lethal weapons.
Walk. Run. Fly. Look all around. Inflict serious pain.
Pillage your way through earthquakes, crumbling bridges and fog.
Track down powerful artifacts and cast wicked spells.
Four sick individuals can wreak havoc via network, two by modem.",,,0742725108264,,,,,,,"{""platform"":""PC (Microsoft Windows), Mac, DOS"",""developer"":""Presage Software""}",,1,7,csv_delicious,1,2026-03-08T04:47:52.255Z,2026-04-06T06:35:42.527Z,,,,,,,"[""digital""]",,,,,,,0,0,false,
1382,Hitman 2,game,Hitman 2 - PlayStation 4,2018-11-13T00:00:00.000Z,2022,Digital,"Shooter, Tactical, Adventure",WB Games,,,,movie,https://www.igdb.com/games/hitman-2,https://images.igdb.com/igdb/image/upload/t_cover_big/co2qcq.jpg,,"Travel the globe and track your targets across exotic sandbox locations in Hitman 2. From sun-drenched streets to dark and dangerous rainforests, nowhere is safe from the world’s most creative assassin, Agent 47 in the ultimate spy thriller story.",,,0883929639571,,Edition: Standard Edition | Platform: PlayStation 4,,,,,"{""platform"":""PlayStation 4"",""developer"":""WB Games""}",,1,7,csv_delicious,1,2026-03-08T05:01:47.995Z,2026-04-06T06:35:42.527Z,,,,,,,"[""digital""]",,,,,,,0,0,false,
1184,Hitman 2 Silent Assassin,game,,2002-09-30T00:00:00.000Z,2018,Digital,"Shooter, Tactical",Square Enix,,,,movie,https://www.igdb.com/games/hitman-2-silent-assassin,https://images.igdb.com/igdb/image/upload/t_cover_big/co1pdt.jpg,,"Enter the realm of a retired assassin, forced back into action by treason. You may be a hired killer but you still have a sense of loyalty and justice. Visit the dark recesses of a world corrupted by crime, greed, degradation and dishonor. And a past that catches up with you.

Trust no one - if the price is right, the finger of your most trusted ally will be on the trigger. Your targets may hide in the most remote areas of the planet, but their destruction is never prevented - only postponed.

Learn your trade - master your tools - overcome your obstacles - outsmart your enemies - eliminate your targets. Remember: rash decisions bleed consequences. Know when to strike instantly, know when to take your time. Chance favors the prepared. Failure is not an option.",,,5032921017374,,,,,,,"{""platform"":""Xbox, Nintendo GameCube, PC (Microsoft Windows), PlayStation 2"",""developer"":""Eidos Interactive""}",,1,7,csv_delicious,1,2026-03-08T04:58:19.535Z,2026-04-06T06:35:42.527Z,,,,,,,"[""digital""]",,,,,,,0,0,false,
1185,Hitman: Absolution,game,,2012-11-20T00:00:00.000Z,2012,Digital,"Shooter, Tactical, Adventure",Square Enix,,,,movie,https://www.igdb.com/games/hitman-absolution,https://images.igdb.com/igdb/image/upload/t_cover_big/co1qrc.jpg,,"Hitman: Absolution follows the Original Assassin undertaking his most personal contract to date. Betrayed by the Agency and hunted by the police, Agent 47 finds himself pursuing redemption in a corrupt and twisted world.

Showcasing Io-Interactive’s new proprietary Glacier 2 technology, the game has been built from the ground up, boasting a cinematic story, distinctive art direction and highly original game design, Hitman Absolution combines much loved classic gameplay with completely new gameplay features for the Hitman franchise.",,,0745449850792,,Edition: Standard | Platform: Xbox 360,,,,,"{""platform"":""Xbox 360"",""developer"":""Square Enix""}",,1,7,csv_delicious,1,2026-03-08T04:58:20.632Z,2026-04-06T06:35:42.527Z,,,,,,,"[""digital""]",,,,,,,0,0,false,
1251,Homefront PS3,game,,,2018,Digital,,THQ,,,,movie,,,,,,,4005209143899,,Platform: PlayStation 3,,,,,"{""platform"":""PlayStation 3""}",,1,7,csv_delicious,1,2026-03-08T04:59:25.309Z,2026-04-06T06:35:42.527Z,,,,,,,"[""digital""]",,,,,,,0,0,false,
956,Horizon Forbidden West Special Edition,game,Horizon Forbidden West Special Edition - PlayStation 5,2022-02-18T00:00:00.000Z,2022,Digital,"Role-playing (RPG), Adventure",PlayStation,,,,movie,https://www.igdb.com/games/horizon-forbidden-west-special-edition,https://images.igdb.com/igdb/image/upload/t_cover_big/co4anw.jpg,,"Horizon Forbidden West continues Aloy’s story as she moves west to a far-future America to brave a majestic, but dangerous frontier where she’ll face awe-inspiring machines and mysterious new threats.

Horizon Forbidden West: Special Edition includes:
- Full game
- SteelBook
- Mini art book
- Digital soundtrack",,,0711719545972,,Edition: PlayStation 5 Special Edition | Platform: PlayStation 5,,,,,"{""platform"":""PlayStation 5"",""developer"":""Guerrilla Games""}",,1,7,csv_delicious,1,2026-03-08T04:54:09.061Z,2026-04-06T06:35:42.527Z,,,,,,,"[""digital""]",,,,,,,0,0,false,
957,Horizon Zero Dawn: Complete Edition,game,Horizon Zero Dawn: Complete Edition - PlayStation 4,2014-01-01T00:00:00.000Z,2014,Digital,"Shooter, Role-playing (RPG), Adventure",PlayStation,,,,movie,https://www.igdb.com/games/horizon-zero-dawn-complete-edition,https://images.igdb.com/igdb/image/upload/t_cover_big/co2tem.jpg,,"In an era where machines roam the land and mankind is no longer the dominant species, a young hunter named Aloy embarks on a journey to discover her destiny. Explore a vibrant and lush world inhabited by mysterious mechanized creatures. Embark on a compelling, emotional journey and unravel mysteries of tribal societies, ancient artefacts and enhanced technologies that will determine the fate of this planet and of life itself.

Horizon: Zero Dawn Complete Edition includes Horizon Zero Dawn and the frozen wilds expansion.",,,0711719516118,,Edition: Standard | Platform: PlayStation 4,,,,,"{""platform"":""PlayStation 4"",""developer"":""Sony Interactive Entertainment""}",,1,7,csv_delicious,1,2026-03-08T04:54:10.283Z,2026-04-06T06:35:42.527Z,,,,,,,"[""digital""]",,,,,,,0,0,false,
1085,House of the Dead III,game,House of the Dead III - Xbox,2002-06-01T00:00:00.000Z,2018,Digital,Shooter,SEGA,,,,movie,https://www.igdb.com/games/the-house-of-the-dead-iii,https://images.igdb.com/igdb/image/upload/t_cover_big/co8op9.jpg,,"The House of the Dead III is a 2002 light gun arcade game with a horror zombie-survival theme, and the third installment to the House of the Dead series of video games, developed by Wow Entertainment and Sega. It was later ported to the Xbox in 2003, Microsoft Windows in 2005, the Wii in 2008 in a compilation with The House of the Dead 2, and PlayStation 3 in 2012 with PlayStation Move support. The game continues the story of the previous games and introduces new gameplay concepts such as story branching. The game's protagonist is Lisa Rogan, daughter of Thomas Rogan, the first game's main character, and players control Lisa, G, or Daniel Curien.",,,0010086640069,,Platform: Xbox,,,,,"{""platform"":""Xbox"",""developer"":""Sega""}",,1,7,csv_delicious,1,2026-03-08T04:56:25.571Z,2026-04-06T06:35:42.527Z,,,,,,,"[""digital""]",,,,,,,0,0,false,
1086,House of the Dead: Overkill,game,House of the Dead: Overkill - Nintendo Wii,2009-02-01T00:00:00.000Z,2009,Digital,Shooter,SEGA,,,,movie,https://www.igdb.com/games/the-house-of-the-dead-overkill,https://images.igdb.com/igdb/image/upload/t_cover_big/co28bb.jpg,,"Overkill is a rail shooter, with pre-determined character movement, while the shooting element under player control by pointing the Wii Remote at the screen, moving the aiming reticle. The player can point the reticle near the edge of the screen to move the camera angle slightly in that direction, allowing a further field of view known as ""Danger Cam"". The story mode can be played solo or with another human player, with one weapon or dual-wielding controls.",,,0010086650204,,Edition: Standard | Platform: Nintendo Wii,,,,,"{""platform"":""Nintendo Wii"",""developer"":""Sega""}",,1,7,csv_delicious,1,2026-03-08T04:56:26.702Z,2026-04-06T06:35:42.527Z,,,,,,,"[""digital""]",,,,,,,0,0,false,
1158,Ico,game,Ico - PlayStation 2,2012-01-12T00:00:00.000Z,2014,Digital,"Platform, Puzzle, Adventure",Sony,,,,movie,https://www.igdb.com/games/ico--1,https://images.igdb.com/igdb/image/upload/t_cover_big/co7221.jpg,,"Experience the wonder and magic of one of the most beloved video games of all time, now available with full HD graphics, 7.1 surround sound, and stereoscopic 3D support.

A young boy is locked away deep in a castle after horns started growing out of his head. After breaking free from his confines, he rescues a mysterious girl from her cage. Together they must escape the dangers of the castle and fend off the shadow creatures haunting their every move.

ICO is a harrowing and emotional adventure unlike any other. Experience one of the most highly acclaimed video games of all time.",,,0711719711322,,Edition: Standard | Platform: PlayStation 2,,,,,"{""platform"":""PlayStation 2"",""developer"":""Bluepoint Games""}",,1,7,csv_delicious,1,2026-03-08T04:57:47.255Z,2026-04-06T06:35:42.527Z,,,,,,,"[""digital""]",,,,,,,0,0,false,
