id,title,media_type,original_title,release_date,year,format,genre,director,rating,user_rating,tmdb_id,tmdb_media_type,tmdb_url,poster_path,backdrop_path,overview,trailer_url,runtime,upc,location,notes,season_number,episode_number,episode_title,network,type_details,series_id,space_id,library_id,import_source,added_by,created_at,updated_at,signed_by,signed_role,signed_on,signed_at,signed_proof_path,cast_members,owned_formats,estimated_value_low,estimated_value_mid,estimated_value_high,valuation_currency,valuation_source,valuation_last_updated,tv_season_count,tv_completed_season_count,tv_all_seasons_completed,cast
1193,Mindjack,game,Mindjack - Xbox 360,2010-12-31T00:00:00.000Z,2010,Digital,Shooter,Square Enix,,,,movie,https://www.igdb.com/games/mindjack,https://images.igdb.com/igdb/image/upload/t_cover_big/co8lmo.jpg,,"MindJack is a third-person shooter video game developed by feelplus and published by Square Enix. The game was released for PlayStation 3 and Xbox 360. MindJack takes place in 2031, when the world’s governments are in decline and new corrupt organizations are arising. The player can “hack” into and control enemies, vehicles, robots, or civilians. In the campaign story mode, the game is single-player but “transitions seamlessly” into co-op.",,,0662248910246,,Edition: Standard | Platform: Xbox 360,,,,,"{""platform"":""Xbox 360"",""developer"":""Square Enix""}",,1,7,csv_delicious,1,2026-03-08T04:58:30.608Z,2026-04-06T06:35:42.527Z,,,,,,,"[""digital""]",,,,,,,0,0,false,
1416,Minecraft \u2013 Xbox 361,game,,2013-06-04T00:00:00.000Z,2013,Digital,,Xbox,,,,movie,,,,,,,0000350092144,,Edition: Standard | Platform: Xbox 360,,,,,"{""platform"":""Xbox 360""}",,1,7,csv_delicious,1,2026-03-08T05:02:30.921Z,2026-04-06T06:35:42.527Z,,,,,,,"[""digital""]",,,,,,,0,0,false,
1194,Mini Ninjas,game,Mini Ninjas - Playstation 3,2010-07-30T00:00:00.000Z,2010,Digital,"Platform, Adventure",Square Enix,,,,movie,https://www.igdb.com/games/mini-ninjas,https://images.igdb.com/igdb/image/upload/t_cover_big/co21i5.jpg,,Mini Ninjas is a game that combines furious action with stealth and exploration for an experience that appeals to a wide audience across age groups and preferences. It’s an action-adventure with a strong focus on allowing the player freedom to explore the world and has the depth to allow for very varied gameplay and approaches to getting through the game.,,,0788687500807,,Edition: Standard | Platform: PlayStation 3,,,,,"{""platform"":""PlayStation 3"",""developer"":""Magic Pockets""}",,1,7,csv_delicious,1,2026-03-08T04:58:31.703Z,2026-04-06T06:35:42.527Z,,,,,,,"[""digital""]",,,,,,,0,0,false,
874,Mission Impossible: Operation Surma,game,Mission Impossible: Operation Surma - GameCube,2003-12-02T00:00:00.000Z,2018,Digital,,Nintendo,,,,movie,https://www.igdb.com/games/mission-impossible-operation-surma--1,https://images.igdb.com/igdb/image/upload/t_cover_big/co6gww.jpg,,,,,0742725238756,,Edition: Standard | Platform: Nintendo GameCube,,,,,"{""platform"":""Nintendo GameCube"",""developer"":""Atari, Inc.""}",,1,7,csv_delicious,1,2026-03-08T04:52:37.907Z,2026-04-06T06:35:42.527Z,,,,,,,"[""digital""]",,,,,,,0,0,false,
1165,MLB Slugfest 2003,game,MLB Slugfest 2003 - PlayStation 2,2002-06-24T00:00:00.000Z,2020,Digital,Sport,Sony,,,,movie,https://www.igdb.com/games/mlb-slugfest-2003,https://images.igdb.com/igdb/image/upload/t_cover_big/co7l5d.jpg,,"MLB Slugfest is a series of baseball games developed by Sports Mogul, Gratuitous Games and Midway Games, and released by Midway Games for major console systems such as PlayStation 2, Nintendo GameCube, and Xbox. The game bills itself as a more ""street"" style baseball game, including more mature / aggressive themes, the ability to attack other players, and urban-styled in-game commentary.",,,,,Edition: Standard | Platform: PlayStation 2,,,,,"{""platform"":""PlayStation 2"",""developer"":""Midway Games""}",,1,7,csv_delicious,1,2026-03-08T04:57:55.956Z,2026-04-06T06:35:42.527Z,,,,,,,"[""digital""]",,,,,,,0,0,false,
253,Monster Garage,game,Monster Garage - Xbox,2004-12-31T00:00:00.000Z,2020,Digital,Simulator,ACTIVISION,,,,movie,https://www.igdb.com/games/monster-garage,https://images.igdb.com/igdb/image/upload/t_cover_big/dzelsxdaveapby2xe2em.jpg,,,,,,,Edition: Standard | Platform: Xbox,,,,,"{""platform"":""Xbox"",""developer"":""Invictus Games Ltd""}",,1,7,csv_delicious,1,2026-03-08T04:41:56.216Z,2026-04-12T17:43:28.661Z,,,,,,,"[""digital""]",,,,,,,0,0,false,
1195,Monster Lab,game,Monster Lab - PlayStation 2,2008-11-05T00:00:00.000Z,2008,Digital,"Puzzle, Role-playing (RPG), Simulator, Strategy",Square Enix,,,,movie,https://www.igdb.com/games/monster-lab,https://images.igdb.com/igdb/image/upload/t_cover_big/co7jus.jpg,,"Will you create the ultimate monster?
Perform outrageous experiements to build your very own mad monsters! Face creepy quests and challenges in the eerie uncanny valley and pitch your ultimate creations in fierce combat against the super-evil Baron and his grotesque army of monsters.",,,0788687500753,,Edition: Standard | Platform: PlayStation 2,,,,,"{""platform"":""PlayStation 2"",""developer"":""Backbone Entertainment""}",,1,7,csv_delicious,1,2026-03-08T04:58:32.793Z,2026-04-06T06:35:42.527Z,,,,,,,"[""digital""]",,,,,,,0,0,false,
1166,Monster Madness: Grave Danger,game,,2008-08-07T00:00:00.000Z,2008,Digital,Shooter,Sony,,,,movie,https://www.igdb.com/games/monster-madness-grave-danger,https://images.igdb.com/igdb/image/upload/t_cover_big/h6cqjiii6afqndywiiwn.jpg,,"Monster Madness: Grave Danger is a video game for the PlayStation 3. Developers Psyonix took Monster Madness: Battle for Suburbia and ported it to the PlayStation 3, adding 25 new challenge modes, 4-player online co-op for the adventure mode, reworking the control scheme, adding 100 character-specific purchasable accessories, new unlockable character costumes, and changing the camera system.[2] While Battle for Suburbia was originally developed by Artificial Studios, publisher SouthPeak Interactive brought the title to Psyonix to rework the core gameplay and port the game to the PlayStation 3.

On 2 February 2011, it was announced that Monster Madness would be ported to Android.[",,,0612561600034,,Edition: Standard | Platform: PlayStation 3,,,,,"{""platform"":""PlayStation 3"",""developer"":""Psyonix""}",,1,7,csv_delicious,1,2026-03-08T04:57:57.184Z,2026-04-06T06:35:42.527Z,,,,,,,"[""digital""]",,,,,,,0,0,false,
1120,Mortal Kombat,game,,2011-04-19T00:00:00.000Z,2014,Digital,Fighting,"Sega Of America, Inc.",,,,movie,https://www.igdb.com/games/mortal-kombat,https://images.igdb.com/igdb/image/upload/t_cover_big/co20mc.jpg,,"Mortal Kombat is a 2011 fighting game developed by NetherRealm Studios. It is the ninth main installment in the Mortal Kombat franchise and a soft reboot of the series. Although beginning during the events of Mortal Kombat: Armageddon, the plot retroactively revisits the earliest period in the Mortal Kombat series: the events of the first three games. The storyline follows Raiden, the divine protector of Earth, as he attempts to change the outcome of the Armageddon events by contacting his past self.",,,0734549001081,,Platform: Sega Genesis,,,,,"{""platform"":""Sega Genesis"",""developer"":""NetherRealm Studios""}",,1,7,csv_delicious,1,2026-03-08T04:57:12.026Z,2026-04-06T06:35:42.527Z,,,,,,,"[""digital""]",,,,,,,0,0,false,
1091,Mortal Kombat II,game,,1994-12-31T00:00:00.000Z,2014,Digital,Fighting,SEGA,,,,movie,https://www.igdb.com/games/mortal-kombat-ii--1,https://images.igdb.com/igdb/image/upload/t_cover_big/co6h3h.jpg,,Mortal Kombat II is a pirated port of Mortal Kombat made by Cony Soft (known as Yoko Soft in this game) in 1994. This should not be mistaken for Mortal Kombat II (Hummer Team).,,,0783651704625,,Edition: Standard | Platform: Sega Genesis,,,,,"{""platform"":""Sega Genesis"",""developer"":""Yoko Soft""}",,1,7,csv_delicious,1,2026-03-08T04:56:32.179Z,2026-04-06T06:35:42.527Z,,,,,,,"[""digital""]",,,,,,,0,0,false,
970,MotorStorm,game,MotorStorm - Playstation 3,2007-03-07T00:00:00.000Z,2007,Digital,Racing,PlayStation,,,,movie,https://www.igdb.com/games/motorstorm,https://images.igdb.com/igdb/image/upload/t_cover_big/co26t9.jpg,,"Welcome to MotorStorm, the world's most brutal off-road racing event where the goal is to win at all costs. Choose from seven vehicle types, from high-flying dirt bikes to powerful big rigs, and destroy anything that gets in your way in a no-holds barred sprint to the finish. Try and survive. Real-Time Deforming Terrain: The terrain literally gets torn up with each passing vehicle, causing each lap to be different. Advanced particle effects cause debris and muck to ""stick"" to each vehicle. Vehicular Combat and Damage: Destroy anything that gets in your way. Smash your opponents and view spectacular Hollywood-style crash sequences. Take the Race Online: Intense head-to-head off-road racing. Challenge the competition over voice chat. AI opponents simulate human traits, like showing off, attacking, taunting, and doing whatever it takes to win.",,,0021111317870,,Edition: Standard | Platform: PlayStation 3,,,,,"{""platform"":""PlayStation 3"",""developer"":""Evolution Studios""}",,1,7,csv_delicious,1,2026-03-08T04:54:29.048Z,2026-04-06T06:35:42.527Z,,,,,,,"[""digital""]",,,,,,,0,0,false,
971,Mummy: Tomb of the Dragon Emperor,game,Mummy: Tomb of the Dragon Emperor - PS2,2008-07-22T00:00:00.000Z,2020,Digital,Adventure,PlayStation,,,,movie,https://www.igdb.com/games/the-mummy-tomb-of-the-dragon-emperor,https://images.igdb.com/igdb/image/upload/t_cover_big/co5x5c.jpg,,"The Mummy: Tomb of the Dragon Emperor is a 3D action-adventure game that was released alongside the The Mummy: Tomb of the Dragon Emperor movie. The game follows the story of the movie. You play as either Rick O'Connell or his son, Alex O'Connell and have to thwart the plans of the Dragon emperor and his Terracotta army.",,,,,Platform: PlayStation 2,,,,,"{""platform"":""PlayStation 2"",""developer"":""A2M""}",,1,7,csv_delicious,1,2026-03-08T04:54:30.146Z,2026-04-06T06:35:42.527Z,,,,,,,"[""digital""]",,,,,,,0,0,false,
509,Mutant League Football,game,Mutant League Football - Sega Genesis,1993-10-10T00:00:00.000Z,2014,Digital,Sport,Electronic Arts,,,,movie,https://www.igdb.com/games/mutant-league-football,https://images.igdb.com/igdb/image/upload/t_cover_big/co5oy3.jpg,,"Anything can happen when the most awesome mutants battle to prove who rules the galactic gridiron. 16 vicious teams of aliens, robots, trolls, skeletons and super-humans. Set the ""Death Index"" from Rough, all the way up to Annihilation. Call wild plays or nasty audibles - when the QB throws a bomb, it's the real thing! Watch instant replays to see where the body parts land. Throw TNT at the halftime marching band.",,,0014633070811,,Platform: Sega Genesis,,,,,"{""platform"":""Sega Genesis"",""developer"":""Tec Toy""}",,1,7,csv_delicious,1,2026-03-08T04:46:33.041Z,2026-04-12T17:48:05.429Z,,,,,,,"[""digital""]",,,,,,,0,0,false,
510,Mutant League Hockey,game,Mutant League Hockey - Sega Genesis,1994-12-31T00:00:00.000Z,2014,Digital,Sport,Electronic Arts,,,,movie,https://www.igdb.com/games/mutant-league-hockey,https://images.igdb.com/igdb/image/upload/t_cover_big/co5oy4.jpg,,"Hockey with an attitude! It's mutated mayhem on the ice in the wildest, funniest, goriest game ever. 23 wild mutant teams and 23 unique arenas, each with bizarre obstacles like exploding mines and ice pits. Call nasty plays like exploding pucks and rocket packs. Set the level of gory action, then watch the body parts go flying. Unique rules like bribing refs, funny penalties, and 2-point bonus goals. Use wild weapons: axes, sledgehammers and chainsaws. Two types of nets - Standard and Battle (protected by spikes). Substitute tired goalies with the ""Demon Net.""",,,0014633072259,,Platform: Sega Genesis,,,,,"{""platform"":""Sega Genesis"",""developer"":""Electronic Arts""}",,1,7,csv_delicious,1,2026-03-08T04:46:34.121Z,2026-04-12T17:48:06.443Z,,,,,,,"[""digital""]",,,,,,,0,0,false,
511,MVP Baseball 2004,game,,2004-03-09T00:00:00.000Z,2004,Digital,"Simulator, Sport",Electronic Arts,,,,movie,https://www.igdb.com/games/mvp-baseball-2004,https://images.igdb.com/igdb/image/upload/t_cover_big/co7l5h.jpg,,"EA takes its MVP Baseball franchise to the next level in 2004. Features realistic player models, historic ballparks and players, full EA Sports Bio compatibility, and an enhanced franchise mode. The all-new Advanced Hitting Control lets you place the bat where you want it. Control the field as you leap over the wall to rob home runs, hook slide into 3rd or barrel over the catcher at home. Manage your team—from the minors to the pros—and take your ball club to win the World Series!

Groundbreaking hitting control makes it possible to pull the ball down, or swing for the fences -- all swing types included
Total control on the field - Leap over the wall and rob home runs, hook slide to avoid tags, and take out the catcher at home
Pick a park - each stadium has its own personality, from unique crowd chants to personal lighting
Control your franchise on every level -- play the game or become a manager & take players from the minors to the pros",,,0014633147490,,Edition: Standard | Platform: Xbox,,,,,"{""platform"":""Xbox"",""developer"":""EA Sports""}",,1,7,csv_delicious,1,2026-03-08T04:46:35.170Z,2026-04-12T17:48:07.548Z,,,,,,,"[""digital""]",,,,,,,0,0,false,
844,My Friend Pedro,game,,2019-06-20T00:00:00.000Z,2021,Digital,"Shooter, Platform, Adventure, Indie, Arcade",Nighthawk Interactive,,,,movie,https://www.igdb.com/games/my-friend-pedro,https://images.igdb.com/igdb/image/upload/t_cover_big/coa4j0.jpg,,"My Friend Pedro is a violent ballet about friendship, imagination, and one man’s struggle to obliterate anyone in his path at the behest of a sentient banana.",,,0860001822021,,,,,,,"{""platform"":""PlayStation 4, PC (Microsoft Windows), Xbox One, Nintendo Switch"",""developer"":""22nd Century Toys""}",,1,7,csv_delicious,1,2026-03-08T04:51:56.999Z,2026-04-06T06:35:42.527Z,,,,,,,"[""digital""]",,,,,,,0,0,false,
1295,My Spanish Coach,game,My Spanish Coach - Nintendo DS,2007-11-30T00:00:00.000Z,2007,Digital,Quiz/Trivia,Ubisoft,,,,movie,https://www.igdb.com/games/my-spanish-coach,https://images.igdb.com/igdb/image/upload/t_cover_big/co4muk.jpg,,"From the makers of My Word Coach, this educational game teaches Spanish through mini-games, and evaluates your progress.",,,0008888163916,,Edition: Standard | Platform: Nintendo DS,,,,,"{""platform"":""Nintendo DS"",""developer"":""Sensory Sweep Studios""}",,1,7,csv_delicious,1,2026-03-08T05:00:16.416Z,2026-04-06T06:35:42.527Z,,,,,,,"[""digital""]",,,,,,,0,0,false,
742,Myst III: Exile,game,,2001-05-07T00:00:00.000Z,2017,Digital,"Point-and-click, Puzzle, Adventure",MediaQuest,,,,movie,https://www.igdb.com/games/myst-iii-exile,https://images.igdb.com/igdb/image/upload/t_cover_big/co3wi6.jpg,,"MYST III: EXILE introduces a new villain Saavedro, who seeks revenge when he finds out his homeland was destroyed by Atrus' sons. The player must track the villain through several surrealistic Ages, navigating puzzles to uncover the truth behind this new adversary. Only then can disaster be averted to choose who was right and who was wrong.

Saavedro is played by Academy Award nominee Brad Dourif (One Flew Over the Cuckoo's Nest).",,,4530267100015,,Platform: Xbox,,,,,"{""platform"":""Xbox"",""developer"":""Presto Studios""}",,1,7,csv_delicious,1,2026-03-08T04:50:07.032Z,2026-04-06T06:35:42.527Z,,,,,,,"[""digital""]",,,,,,,0,0,false,
676,Mystical Ninja Starring Goemon,game,,1998-04-16T00:00:00.000Z,1998,Digital,"Role-playing (RPG), Adventure",Konami,,,,movie,https://www.igdb.com/games/mystical-ninja-starring-goemon--1,https://images.igdb.com/igdb/image/upload/t_cover_big/co5rce.jpg,,"It's big trouble in little Edo when Goemon, the original Mystical Ninja bursts into town! Get ready to take on the whole Evil Ship Gang as you fight your way across the ancient countryside, through bustling villages, and all the way to Skull Island. Throw in a few wacky bonus games, and you've got an adventure as legendary as its name!",,,0083717180043,,,,,,,"{""platform"":""Nintendo 3DS, Game Boy"",""developer"":""Konami Digital Entertainment""}",,1,7,csv_delicious,1,2026-03-08T04:49:06.248Z,2026-04-06T06:35:42.527Z,,,,,,,"[""digital""]",,,,,,,0,0,false,
300,Namco Mueseum,game,,,2014,Digital,,BANDAI,,,,movie,,,,,,,0722674021098,,,,,,,"{""platform"":""PlayStation2""}",,1,7,csv_delicious,1,2026-03-08T04:42:46.219Z,2026-04-12T17:44:18.526Z,,,,,,,"[""digital""]",,,,,,,0,0,false,
512,NASCAR Thunder 2003,game,NASCAR Thunder 2003 - Xbox,2002-09-19T00:00:00.000Z,2018,Digital,Racing,Electronic Arts,,,,movie,https://www.igdb.com/games/nascar-thunder-2003--1,https://images.igdb.com/igdb/image/upload/t_cover_big/co6b4v.jpg,,PlayStation port of NASCAR Thunder 2003.,,,0014633145274,,Edition: Standard | Platform: Xbox,,,,,"{""platform"":""Xbox"",""developer"":""EA Sports""}",,1,7,csv_delicious,1,2026-03-08T04:46:36.344Z,2026-04-12T17:48:08.653Z,,,,,,,"[""digital""]",,,,,,,0,0,false,
768,NBA Street Vol 2,game,,2003-04-28T00:00:00.000Z,2018,Digital,"Sport, Adventure",Microsoft,,,,movie,https://www.igdb.com/games/nba-street-vol-2,https://images.igdb.com/igdb/image/upload/t_cover_big/co2etl.jpg,,"NBA Street Vol. 2 is a basketball video game, published by EA Sports BIG and developed by EA Canada. It is the sequel to NBA Street and the second game in the NBA Street series. It was released on April 28, 2003 for the PlayStation 2, GameCube, and, for the first time in the series, on the Xbox. Japan was only able to see a PlayStation 2 release of this game. The GameCube version was also planned to be released in that region, but it was canceled for unknown reasons.",,,0014633352054,,Edition: Standard | Platform: Xbox,,,,,"{""platform"":""Xbox"",""developer"":""EA Canada""}",,1,7,csv_delicious,1,2026-03-08T04:50:41.137Z,2026-04-06T06:35:42.527Z,,,,,,,"[""digital""]",,,,,,,0,0,false,
513,NCAA Football 2004,game,NCAA Football 2004 - Xbox,2003-12-10T00:00:00.000Z,2018,Digital,Sport,Electronic Arts,,,,movie,https://www.igdb.com/games/ncaa-football-2004--1,https://images.igdb.com/igdb/image/upload/t_cover_big/co3z7k.jpg,,"This is an N-Gage version of the game. In general it follows the same rules as a console release: it's an American football ""simulator"" where you can choose a team from a vast roster corresponding with 2003 season, pick strategies from a number of offensive and defensive plays and then command your players on the field. Also you can take a look at some of the historical teams and games. But there are a few differences.

The first and most obvious one is graphics - the N-Gage game has a totally different graphical engine: instead of a fully 3D world, only the field is polygonal and sprites are used for the players models, thus making it more close to the sports games of the 90s. Secondly, Dynasty mode that lets you customize the team, build programs and recruit new members is absent, instead there are only quick play and season modes. Also, there's a one-on-one Bluetooth multiplayer and a bowl game called Nokia Sugar Bowl National Championship.",,,0014633146417,,Edition: Standard | Platform: Xbox,,,,,"{""platform"":""Xbox"",""developer"":""EA Sports""}",,1,7,csv_delicious,1,2026-03-08T04:46:37.433Z,2026-04-12T17:48:09.885Z,,,,,,,"[""digital""]",,,,,,,0,0,false,
514,Need for Speed Unbound,game,Need for Speed Unbound - Xbox Series X,2022-11-29T00:00:00.000Z,2024,Digital,Racing,Electronic Arts,,,,movie,https://www.igdb.com/games/need-for-speed-unbound,https://images.igdb.com/igdb/image/upload/t_cover_big/co5fsv.jpg,,"Race against time, outsmart the cops, and take on weekly qualifiers to reach The Grand, Lakeshore's ultimate street racing challenge. Pack your garage with precision-tuned, custom rides and light up the streets with your style, exclusive fits, and a vibrant global soundtrack that bumps in every corner of the world.",,,0014633742664,,Edition: Standard | Platform: Xbox Series X,,,,,"{""platform"":""Xbox Series X"",""developer"":""Electronic Arts""}",,1,7,csv_delicious,1,2026-03-08T04:46:38.591Z,2026-04-12T17:48:10.861Z,,,,,,,"[""digital""]",,,,,,,0,0,false,
677,NeverDead,game,NeverDead - Xbox 360,2012-01-31T00:00:00.000Z,2012,Digital,Shooter,Konami,,,,movie,https://www.igdb.com/games/neverdead,https://images.igdb.com/igdb/image/upload/t_cover_big/co4gjl.jpg,,"NeverDead begins in the waking hours of peace and calm, when the world is under threat of being consumed by a demonic plague. Centuries have passed since the world succumbed to an unforeseen shadow of evil, and a hero was made an immortal by demons. These demons have risen once again in the present day causing unrelenting mayhem reinforced by destructible environments within the game. Now using his immortalic regenerative powers re-assembling his own body to evade death, the hero carries out the only salvation the world will know, for he is Never Dead.",,,0151902988795,,Edition: Standard | Platform: Xbox 360,,,,,"{""platform"":""Xbox 360"",""developer"":""Konami""}",,1,7,csv_delicious,1,2026-03-08T04:49:07.341Z,2026-04-06T06:35:42.527Z,,,,,,,"[""digital""]",,,,,,,0,0,false,
875,New Super Luigi,game,,2013-08-25T00:00:00.000Z,2013,Digital,"Platform, Adventure",Nintendo,,,,movie,https://www.igdb.com/games/new-super-luigi-u,https://images.igdb.com/igdb/image/upload/t_cover_big/co21tt.jpg,,"With Mario nowhere to be found, it’s up to Luigi to save the day in a brand-new downloadable adventure that takes place in the world of New Super Mario Bros. U. Experience new gameplay challenges as you guide Luigi, complete with his high jump and unique slide, through all-new courses. Enjoy high replayability and satisfaction from mastering each course, and then share your triumphs via the Miiverse feature. Up to five players* can jump into the fun, with Nabbit taking the place of Mario as a playable character. Help Luigi finally prove he has what it takes!

-Take control of Luigi in his first starring role in a platform adventure

-Level-up your New Super Mario Bros. U experience with more than 80 new courses

-High replayability and satisfaction from mastering each course

-Play with distinct Luigi physics, including his unique slide and gratifying higher and longer jumps

-No time to waste as each course begins with only 100 seconds

-For the first time, play as Nabbit, invincible to enemies and obstacles

-Share triumphs with the community via the Miiverse feature (broadband Internet access required for online features. For more info, go to support.nintendo.com)

-Play using a Wii Remote controller, the Wii U GamePad controller, or a Wii U Pro Controller

-Players must own a copy of New Super Mario Bros. U

New Super Luigi U was also released as a standalone game.",,,0051020072799,,Edition: Standard,,,,,"{""platform"":""Wii U"",""developer"":""Nintendo""}",,1,7,csv_delicious,1,2026-03-08T04:52:39.009Z,2026-04-06T06:35:42.527Z,,,,,,,"[""digital""]",,,,,,,0,0,false,
876,New Super Mario Bros,game,,2006-05-16T00:00:00.000Z,2006,Digital,"Platform, Adventure",Nintendo,,,,movie,https://www.igdb.com/games/new-super-mario-bros,https://images.igdb.com/igdb/image/upload/t_cover_big/co21rm.jpg,,"New Super Mario Bros. is a side-scrolling 2.5D action-adventure platformer game for the Nintendo DS, starring Mario and Luigi. The game features a solo story mode with Mario or Luigi, a two-player wireless game Mario Vs. Luigi, as well as a minigame mode for up to four players. The gameplay of New Super Mario Bros. is very much like that of the classic 2D platformers, mostly Super Mario Bros. and Super Mario Bros. 3, and substantially builds upon them to create gameplay both classic and contemporary. As the game is on DS, the touch screen allows players to store an additional power-up and view the distance still to go in a level.",,,0802645750902,,Edition: Standard | Platform: Nintendo DS,,,,,"{""platform"":""Nintendo DS"",""developer"":""Nintendo Entertainment Analysis & Development""}",,1,7,csv_delicious,1,2026-03-08T04:52:40.117Z,2026-04-06T06:35:42.527Z,,,,,,,"[""digital""]",,,,,,,0,0,false,
877,New Super Mario Bros,game,,2009-11-15T00:00:00.000Z,2009,Digital,"Platform, Adventure",Nintendo,,,,movie,https://www.igdb.com/games/new-super-mario-bros,https://images.igdb.com/igdb/image/upload/t_cover_big/co21rm.jpg,,"New Super Mario Bros. is a side-scrolling 2.5D action-adventure platformer game for the Nintendo DS, starring Mario and Luigi. The game features a solo story mode with Mario or Luigi, a two-player wireless game Mario Vs. Luigi, as well as a minigame mode for up to four players. The gameplay of New Super Mario Bros. is very much like that of the classic 2D platformers, mostly Super Mario Bros. and Super Mario Bros. 3, and substantially builds upon them to create gameplay both classic and contemporary. As the game is on DS, the touch screen allows players to store an additional power-up and view the distance still to go in a level.",,,0045496901738,,Edition: Standard | Platform: Nintendo Wii,,,,,"{""platform"":""Nintendo Wii"",""developer"":""Nintendo Entertainment Analysis & Development""}",,1,7,csv_delicious,1,2026-03-08T04:52:41.219Z,2026-04-06T06:35:42.527Z,,,,,,,"[""digital""]",,,,,,,0,0,false,
