id,title,media_type,original_title,release_date,year,format,genre,director,rating,user_rating,tmdb_id,tmdb_media_type,tmdb_url,poster_path,backdrop_path,overview,trailer_url,runtime,upc,location,notes,season_number,episode_number,episode_title,network,type_details,series_id,space_id,library_id,import_source,added_by,created_at,updated_at,signed_by,signed_role,signed_on,signed_at,signed_proof_path,cast_members,owned_formats,estimated_value_low,estimated_value_mid,estimated_value_high,valuation_currency,valuation_source,valuation_last_updated,tv_season_count,tv_completed_season_count,tv_all_seasons_completed,cast
261,Soldier Of Fortune Payback,game,Soldier Of Fortune Payback - Playstation 3,2007-11-14T00:00:00.000Z,2007,Digital,Shooter,ACTIVISION,,,,movie,https://www.igdb.com/games/soldier-of-fortune-payback,https://images.igdb.com/igdb/image/upload/t_cover_big/co2ino.jpg,,"Soldier of Fortune: Payback is a first-person shooter video game and the third installment of the Soldier of Fortune game series. Unlike the previous two Soldier of Fortune games, which were developed by Raven Software utilizing the Quake 2 and Quake 3 engines, Payback was developed by Cauldron HQ, developed with Cauldron's in-house CloakNT engine, used in their previous first person shooter game, Chaser. It is the first game of the series released for the Xbox 360 and PlayStation 3. The game was released on 14 November 2007.",,,0047875754379,,Edition: Standard | Platform: PlayStation 3,,,,,"{""platform"":""PlayStation 3"",""developer"":""Cauldron HQ""}",,1,7,csv_delicious,1,2026-03-08T04:42:04.929Z,2026-04-12T17:43:37.582Z,,,,,,,"[""digital""]",,,,,,,0,0,false,
1122,Sonic & Knuckles,game,,1994-10-18T00:00:00.000Z,2014,Digital,Platform,"Sega Of America, Inc.",,,,movie,https://www.igdb.com/games/sonic-and-knuckles,https://images.igdb.com/igdb/image/upload/t_cover_big/co1ups.jpg,,"Sonic and Knuckles join forces to defeat rotten Dr. Robotnik's Death Egg invasion! Play Sonic & Knuckles by itself or Lock-on with other Sonic games. This game's revolutionary Lock-on technology adds all new features to your other Sonic games for ultimate replays! Play as Sonic and let loose on Robotnik with amazing new powers. Play as Knuckles and tackle Robotnik and Metal Sonic with bare-fisted attacks, high-speed glides and wall-climbing power! Lock-on with Sonic 3 and transform Floating Island into a huge 34 meg Sonic-epic loaded with new secrets! Play as Sonic, Knuckles, and even Tails - with Game Save! Lock-on with Sonic 2 and play as Knuckles with all his signature moves!",,,0010086015638,,Platform: Sega Genesis,,,,,"{""platform"":""Sega Genesis"",""developer"":""Sonic Team""}",,1,7,csv_delicious,1,2026-03-08T04:57:14.223Z,2026-04-06T06:35:42.527Z,,,,,,,"[""digital""]",,,,,,,0,0,false,
1098,Sonic CD,game,,2011-12-14T00:00:00.000Z,2014,Digital,"Platform, Adventure",SEGA,,,,movie,https://www.igdb.com/games/sonic-cd--1,https://images.igdb.com/igdb/image/upload/t_cover_big/co6o6t.jpg,,"Sonic CD (also known as Sonic CD 2011) is a remaster of the original game, adding many new features like widescreen support, improved controls, access to both American and Japanese soundtracks and Tails as an unlockable playable character.",,,0010086044072,,,,,,,"{""platform"":""Amazon Fire TV, Xbox Series X|S, PlayStation 3, PlayStation 4, Ouya, Linux, Windows Phone, Android, PC (Microsoft Windows), iOS, PlayStation 5, Xbox 360, Xbox One, Nintendo Switch"",""developer"":""Sega""}",,1,7,csv_delicious,1,2026-03-08T04:56:41.010Z,2026-04-06T06:35:42.527Z,,,,,,,"[""digital""]",,,,,,,0,0,false,
1099,Sonic Generations,game,,2011-11-01T00:00:00.000Z,2011,Digital,"Platform, Adventure",SEGA,,,,movie,https://www.igdb.com/games/sonic-generations--1,https://images.igdb.com/igdb/image/upload/t_cover_big/co1zya.jpg,,"In the 3DS version of Sonic Generations, Modern Sonic's gameplay is similar to that of Sonic Rush and the DS version of Sonic Colors. He has the Boost, the ability to slide under obstacles, jump off walls, and the Homing Attack. After the second era, Modern Sonic learns the Stomp. Modern Sonic's levels use the 3D effect of depth on the 3DS version more actively as well as to giving a better view for when Modern Sonic jumps into the background, although the console versions are 3D-TV compatible. In the HD version, Modern Sonic is only able to wall jump off certain panels (similar to the DS version of Sonic Colors), but in the 3DS version, he is able to wall jump on any wall (much like Sonic Unleashed and the Wii version of Sonic Colors).",,,0172302829167,,Edition: Standard | Platform: Xbox 360,,,,,"{""platform"":""Xbox 360"",""developer"":""Sega""}",,1,7,csv_delicious,1,2026-03-08T04:56:42.113Z,2026-04-06T06:35:42.527Z,,,,,,,"[""digital""]",,,,,,,0,0,false,
1100,Sonic Heroes,game,Sonic Heroes - PlayStation 2,2005-03-14T00:00:00.000Z,2005,Digital,"Platform, Adventure",SEGA,,,,movie,https://www.igdb.com/games/sonic-heroes,https://images.igdb.com/igdb/image/upload/t_cover_big/co9olx.jpg,,"Sonic Heroes is an adventure and multiplatform video game in the Sonic The Hedgehog series, developed by Sonic Team and published by SEGA for the Nintendo GameCube, Sony PlayStation 2, Microsoft Xbox and Microsoft Windows PCs.
The player races a team of series characters through levels to amass rings, defeat robots, and collect the seven Chaos Emeralds needed to defeat Doctor Eggman. This game differs from other Sonic games by allowing the player to take control of one of four teams, each with three characters, who each have unique abilities to use. The game received mixed reviews from critics but it performed commercially well, becoming a million-seller and making the best-selling lists for all three of its original platforms.
Join Team Sonic, Team Dark, Team Rose and Team Chaotix in a multiplatform adventure! Run, Fly, use your Power, grind, swing through 7 different levels with unique paths, fighting evil and solving puzzles for each team.",,,0010086630398,,Edition: Standard | Platform: PlayStation 2,,,,,"{""platform"":""PlayStation 2"",""developer"":""Sega""}",,1,7,csv_delicious,1,2026-03-08T04:56:43.216Z,2026-04-06T06:35:42.527Z,,,,,,,"[""digital""]",,,,,,,0,0,false,
1101,Sonic the Hedgehog,game,Sonic the Hedgehog - Playstation 3,2007-01-31T00:00:00.000Z,2007,Digital,"Platform, Adventure",SEGA,,,,movie,https://www.igdb.com/games/sonic-the-hedgehog-473de878-5a9f-402e-a282-86a7460fc1d2,https://images.igdb.com/igdb/image/upload/t_cover_big/co1zve.jpg,,"The game shares its name with two earlier Sonic games, a manga, a television series, a comic book series, and their eponymous main character. To disambiguate, the game has been referred to as Sonic 2006. It was produced in commemoration of the 15th anniversary of the Sonic the Hedgehog series. The game faced multiple issues during development, which resulted in rushing the product despite existing bugs. Both versions were heavily criticized for long loading times, poor camera system, gameplay glitches, complicated plot and sloppy character control.

The game faced development issues which resulted the product being rushed and ultimately a poor product being delivered. Upon release, it was widely criticized for its numerous gameplay glitches, long loading times and complicated plot.",,,0010086690019,,Edition: Standard | Platform: PlayStation 3,,,,,"{""platform"":""PlayStation 3"",""developer"":""Sega""}",,1,7,csv_delicious,1,2026-03-08T04:56:44.482Z,2026-04-06T06:35:42.527Z,,,,,,,"[""digital""]",,,,,,,0,0,false,
1123,Sonic the Hedgehog,game,,2013-05-15T00:00:00.000Z,2014,Digital,"Platform, Arcade","Sega Of America, Inc.",,,,movie,https://www.igdb.com/games/sonic-the-hedgehog--14,https://images.igdb.com/igdb/image/upload/t_cover_big/co1zul.jpg,,"A remastered port of Sonic the Hedgehog for mobile platforms, adding many improvements over the original version, such as the spindash, widescreen support and new playable characters. Run and spin through loop-de-loops as you collect rings and defeat enemies on your mission to save the world from the evil Dr. Eggman.",,,0010086010091,,Platform: Sega Genesis,,,,,"{""platform"":""Sega Genesis"",""developer"":""Headcannon""}",,1,7,csv_delicious,1,2026-03-08T04:57:15.333Z,2026-04-06T06:35:42.527Z,,,,,,,"[""digital""]",,,,,,,0,0,false,
1124,Sonic the Hedgehog 2,game,,2013-12-12T00:00:00.000Z,2014,Digital,"Platform, Arcade","Sega Of America, Inc.",,,,movie,https://www.igdb.com/games/sonic-the-hedgehog-2--4,https://images.igdb.com/igdb/image/upload/t_cover_big/co1zux.jpg,,"One of the best selling SEGA games of all time - Sonic The Hedgehog 2 is now available for free on mobile! Rediscover SEGA’s super Sonic masterpiece!

Dr. Eggman is back to his old tricks, trying to find the seven Chaos Emeralds that will enable him to complete his ultimate weapon, the Death Egg. Only the triple threat of Sonic, Tails, and Knuckles can defeat him in this remaster from the team behind Sonic Mania!

Sonic The Hedgehog 2 joins the ever-increasing line-up of ‘SEGA Forever’, a treasure trove of free SEGA console classics brought to life on mobile for the first time.",,,0010086010510,,Platform: Sega Genesis,,,,,"{""platform"":""Sega Genesis"",""developer"":""Sega""}",,1,7,csv_delicious,1,2026-03-08T04:57:16.434Z,2026-04-06T06:35:42.527Z,,,,,,,"[""digital""]",,,,,,,0,0,false,
1102,"Sonic""s Ultimate Genesis Collection",game,,2009-02-10T00:00:00.000Z,2018,Digital,"Shooter, Platform, Puzzle, Role-playing (RPG), Arcade",SEGA,,,,movie,https://www.igdb.com/games/sonic-s-ultimate-genesis-collection,https://images.igdb.com/igdb/image/upload/t_cover_big/co1upp.jpg,,"The compilation features 48 Sega games (49 counting two versions of Altered Beast) which were previously released for the Mega Drive/Genesis (including most of the Sonic the Hedgehog titles released for the system), arcade and Sega Master System. It is similar to the Sega Genesis Collection released previously for the PlayStation 2 and PSP, however it contains 16 (in NTSC regions) more games (including unlockable extras).",,,0010086680348,,,,,,,"{""platform"":""PlayStation 3, Xbox 360"",""developer"":""Sega""}",,1,7,csv_delicious,1,2026-03-08T04:56:45.586Z,2026-04-06T06:35:42.527Z,,,,,,,"[""digital""]",,,,,,,0,0,false,
1168,Sony PlayStation 98175 Ratchet & Clank: All 4 One PS3,game,,2011-10-18T00:00:00.000Z,2011,Digital,,Sony,,,,movie,,,,,,,0031112808710,,Edition: Standard | Platform: PlayStation 3,,,,,"{""platform"":""PlayStation 3""}",,1,7,csv_delicious,1,2026-03-08T04:58:01.595Z,2026-04-06T06:35:42.527Z,,,,,,,"[""digital""]",,,,,,,0,0,false,
311,Soul Calibur 2,game,Soul Calibur 2 - PlayStation 2,2003-07-25T00:00:00.000Z,2003,Digital,Fighting,BANDAI NAMCO Entertainment,,,,movie,https://www.igdb.com/games/soulcalibur-ii,https://images.igdb.com/igdb/image/upload/t_cover_big/co62a6.jpg,,"SoulCalibur II is the third installment in the Soul series and continues the tradition of his predecessors with improved graphics, new characters and new levels. A majority of the action takes place in Weapon Master mode where you have to choose a character and travel a set map to fight the many other warriors through different levels and challenges. Console ports were released, including guest characters from other franchises.

The Arcade version has a unique mode called ""Conquest Mode"". This mode, which uses a name and password system to save data, allows the player to select one army among four. The player then fights against enemies in a series of eight 1-round battles, win or lose (the first seven are based on the player's rank, and the eighth is chosen by the player – this can only be interrupted by a Versus challenger.) After each round, the player earns EXP and can be promoted, and the game also rates the player in four categories: Soul, Power, Wisdom and Skill. The game also keeps track of which moves the player knows and uses most often. After the eight battles, territory control is updated and the player has the option to fight a bonus round against their character played by the AI.",,,0722674021432,,Edition: Standard | Platform: PlayStation 2,,,,,"{""platform"":""PlayStation 2"",""developer"":""Namco""}",,1,7,csv_delicious,1,2026-03-08T04:42:59.468Z,2026-04-19T16:55:11.120Z,,,,,,,"[""digital""]",,,,,,,0,0,false,
313,Soul Calibur IV,game,Soul Calibur IV - Xbox 360,2008-07-29T00:00:00.000Z,2008,Digital,"Fighting, Arcade",BANDAI NAMCO Entertainment,,,,movie,https://www.igdb.com/games/soulcalibur-iv,https://images.igdb.com/igdb/image/upload/t_cover_big/co9ay2.jpg,,"""Swords will be honed and weapons optimized as the world renowned weapon-based fighting series Soulcalibur unveils a fourth installment. Delivering new gameplay modes, characters and enhanced features with unprecedented 3D modeling and animation, Soulcalibur IV strives to be the definitive fighting game experience. The unrelenting pursuit of two legendary swords continues as Soulcalibur IV re-introduces classic warriors from the series as well as debuting new characters bringing new conflict and intrigue. Soulcalibur IV propels the fighting genre into the next-gen era with visually realistic environments, interactive stages, enhanced AI, and a new battle system.""

Exclusive to the Xbox 360 version is Yoda from Star Wars, who’s inclusion was meant to represent the colours of the Xbox Logo.",,,0722674210058,,Edition: Standard | Platform: Xbox 360,,,,,"{""platform"":""Xbox 360"",""developer"":""Bandai Namco Entertainment""}",,1,7,csv_delicious,1,2026-03-08T04:43:01.566Z,2026-04-12T17:44:33.992Z,,,,,,,"[""digital""]",,,,,,,0,0,false,
469,Soul Fighter,game,,1999-12-01T00:00:00.000Z,2017,Digital,"Fighting, Hack and slash/Beat 'em up",Dreamcast,,,,movie,https://www.igdb.com/games/soul-fighter,https://images.igdb.com/igdb/image/upload/t_cover_big/co43am.jpg,,"Pick the warrior, thief, or wizard, and fight through five huge levels, each with its own boss. Your main weapons are your fists, but you can pull out weapons for quick kills. You only get so many shots with your weapon before it breaks, though.

Gameplay is basic 3D brawling. You will be attacked by one or more enemies, and will need to defend yourself, and attack back. The game features arcade and adventure modes. In the arcade mode, the levels are timed, and you only get 5 lives but you are revived where you died. In adventure mode, you get unlimited retries of each level, but must complete each level on a single life.

Note that your objective in each level is to kill every enemy; since the levels have multiple paths, you will need to backtrack often.",,,0772040786656,,Edition: Standard,,,,,"{""platform"":""Nintendo GameCube, Dreamcast""}",,1,7,csv_delicious,1,2026-03-08T04:45:46.488Z,2026-04-12T17:47:18.955Z,,,,,,,"[""digital""]",,,,,,,0,0,false,
232,South Park - Nintendo 64,game,,,2014,Digital,"Platform, Puzzle",Acclaim,,,,movie,https://www.igdb.com/games/south-park--1,https://images.igdb.com/igdb/image/upload/t_cover_big/co7xp2.jpg,,"South Park was a cancelled puzzle-platformer in which you must rescue Kenny in each level using Stan, Kyle, and Cartman using their unique attributes.",,,0021481641735,,Edition: Standard,,,,,"{""platform"":""Game Boy Color"",""developer"":""Crawfish Interactive""}",,1,7,csv_delicious,1,2026-03-08T04:41:28.640Z,2026-04-12T17:43:01.100Z,,,,,,,"[""digital""]",,,,,,,0,0,false,
987,South Park: Chef's Luv Shack,game,,1999-10-12T00:00:00.000Z,2015,Digital,"Puzzle, Quiz/Trivia",PlayStation,,,,movie,https://www.igdb.com/games/south-park-chef-s-luv-shack,https://images.igdb.com/igdb/image/upload/t_cover_big/co5xx0.jpg,,"South Park: Chef's Luv Shack is a 2D game-show style video game based on the television show South Park. It gained its popularity by having mini games and the ability to play against friends in a challenge for the most points. It also involves trivia questions about South Park and other topics.
The game intermittently switches between questions and minigames, with a minigame proceeding every three questions. Players score points by answering questions first (correctly) and based on minigame ranking. Players lose points for questions answered incorrectly. The game is exclusively multiplayer, as when played by one player, there is no AI, so that player always wins, even with a negative score",,,0021481211907,,Edition: Standard | Platform: PlayStation,,,,,"{""platform"":""PlayStation"",""developer"":""Acclaim Entertainment""}",,1,7,csv_delicious,1,2026-03-08T04:54:48.943Z,2026-04-06T06:35:42.527Z,,,,,,,"[""digital""]",,,,,,,0,0,false,
233,South Park: Rally,game,,2000-01-05T00:00:00.000Z,2017,Digital,Racing,Acclaim,,,,movie,https://www.igdb.com/games/south-park-rally,https://images.igdb.com/igdb/image/upload/t_cover_big/co3b86.jpg,,"Choose your character from the cast of the popular 'mature' cartoon South Park, and tear through the streets in this racing game. Your character's vehicle may be a little cart, trike, or box, for example. Weapons include rockets, Salty Balls, Cheesy Poofs, the beloved Cow and even an Anal probe. All of the voices are also included, making it feel more like the real cartoon than a rally game. You can also play an all-on-all 4 player mode.",,,0021481831976,,Edition: Standard,,,,,"{""platform"":""Nintendo 64, PC (Microsoft Windows), PlayStation, Dreamcast"",""developer"":""Acclaim Entertainment""}",,1,7,csv_delicious,1,2026-03-08T04:41:29.735Z,2026-04-12T17:43:02.185Z,,,,,,,"[""digital""]",,,,,,,0,0,false,
1300,South Park: The Fractured but Whole,game,South Park: The Fractured but Whole - PlayStation 4,2017-10-17T00:00:00.000Z,2017,Digital,"Role-playing (RPG), Strategy, Adventure",Ubisoft,,,,movie,https://www.igdb.com/games/south-park-the-fractured-but-whole,https://images.igdb.com/igdb/image/upload/t_cover_big/co1v8w.jpg,,"Players will once again assume the role of the New Kid, and join South Park favorites Stan, Kyle, Kenny and Cartman in a new hilarious and outrageous adventure. This time, players will delve into the crime-ridden underbelly of South Park with Coon and Friends.

This dedicated group of crime fighters was formed by Eric Cartman whose superhero alter-ego, The Coon, is half man, half raccoon. As the New Kid, players will join Mysterion, Toolshed, Human Kite, Mosquito, Mint Berry Crunch and a host of others to battle the forces of evil while Coon strives to make his team the most beloved superheroes in history.",,,0887256015770,,Edition: Standard | Platform: PlayStation 4,,,,,"{""platform"":""PlayStation 4"",""developer"":""Ubisoft San Francisco""}",,1,7,csv_delicious,1,2026-03-08T05:00:21.901Z,2026-04-06T06:35:42.527Z,,,,,,,"[""digital""]",,,,,,,0,0,false,
1301,South Park: The Stick of Truth,game,South Park: The Stick of Truth - Xbox 360,2013-12-05T00:00:00.000Z,2013,Digital,"Role-playing (RPG), Strategy, Adventure",Ubisoft,,,,movie,https://www.igdb.com/games/south-park-the-stick-of-truth,https://images.igdb.com/igdb/image/upload/t_cover_big/co1v8x.jpg,,"From the perilous battlefields of the fourth-grade playground, a young hero will rise, destined to be South Park’s savior. From the creators of South Park, Trey Parker and Matt Stone, comes an epic quest to become… cool. Introducing South Park: The Stick of Truth.You begin as the new kid in town facing a harrowing challenge: making friends.

As you start your quest the children of South Park are embroiled in a city-wide, live-action-role-playing game, casting imaginary spells and swinging fake swords. Over time the simple children’s game escalates into a battle of good and evil that threatens to consume the world.Arm yourself with weapons of legend to defeat crab people, underpants gnomes, hippies and other forces of evil.

Discover the lost Stick of Truth and earn your place at the side of Stan, Kyle, Cartman and Kenny as their new friend. Succeed, and you shall be South Park’s savior, cementing your social status in South Park Elementary. Fail, and you will forever be known… as a loser.",,,0088885290570,,Edition: Standard | Platform: Xbox 360,,,,,"{""platform"":""Xbox 360"",""developer"":""Obsidian Entertainment""}",,1,7,csv_delicious,1,2026-03-08T05:00:23.009Z,2026-04-06T06:35:42.527Z,,,,,,,"[""digital""]",,,,,,,0,0,false,
1103,Space Channel 5 - Sega Dreamcast,game,,1999-12-16T00:00:00.000Z,2017,Digital,"Music, Adventure",SEGA,,,,movie,https://www.igdb.com/games/space-channel-5,https://images.igdb.com/igdb/image/upload/t_cover_big/co1p13.jpg,,"It's the 25th century and our intergalactic space reporter dives into an adventure where she must battle with a series of dastardly villains! Are you ready to save the universe through the medium of dance? You must first battle wicked space nasties, the Morolians, who have attacked and subdued innocent Earthlings with their dance-inflicting ray guns. In order to break the Morolian's hypnotic grasp, Ulala must mimic the aliens' exact dance moves by keeping the beat with pauses timed to perfection. But the adventure isn't over just yet; Ulala must also face another group of intergalactic terrorists who have designs on world domination.",,,0010086510515,,Edition: Standard,,,,,"{""platform"":""Dreamcast, PlayStation 2"",""developer"":""United Game Artists""}",,1,7,csv_delicious,1,2026-03-08T04:56:47.777Z,2026-04-06T06:35:42.527Z,,,,,,,"[""digital""]",,,,,,,0,0,false,
1063,Space Harrier,game,,1988-12-01T00:00:00.000Z,2014,Digital,"Shooter, Arcade",Sega,,,,movie,https://www.igdb.com/games/space-harrier--5,https://images.igdb.com/igdb/image/upload/t_cover_big/co95vy.jpg,,"The Amiga Port of ""Space Harrier"".

Space Harrier on the Amiga is a port of Sega's classic rail shooter. Players control a jetpack-equipped protagonist who flies through surreal, colorful landscapes, battling bizarre enemies and large bosses. The game features fast-paced action as the hero weaves through obstacles and projectiles while firing at incoming threats. While adapting the arcade original to home computer hardware, this version aims to recreate the high-speed, fantastical experience of the original within the Amiga's capabilities.",,,0010086845051,,,,,,,"{""platform"":""Amiga"",""developer"":""Sega AM2""}",,1,7,csv_delicious,1,2026-03-08T04:55:59.159Z,2026-04-06T06:35:42.527Z,,,,,,,"[""digital""]",,,,,,,0,0,false,
262,Spider-Man 3 - PlayStation 2,game,,2007-05-04T00:00:00.000Z,2007,Digital,Platform,ACTIVISION,,,,movie,https://www.igdb.com/games/spider-man-3,https://images.igdb.com/igdb/image/upload/t_cover_big/co2nc4.jpg,,"The next-gen version of Spider-Man 3, a videogame based on the 2007 movie of the same name.

Spider-Man 3 is an action-adventure video game played from a third-person perspective, featuring an open-world rendition of Manhattan as its setting. In the game, players assume the role of Spider-Man and engage in missions, which are essentially scenarios with specific objectives that drive the storyline forward. These missions are designed to be completed in a non-linear fashion, providing players with some freedom in how they tackle them.

As Spider-Man, players can utilize web-swinging, wall-crawling, and a range of combat combos to confront and defeat various enemies.",,,0047875819351,,Edition: Standard,,,,,"{""platform"":""PlayStation 3, PC (Microsoft Windows), Xbox 360"",""developer"":""Beenox""}",,1,7,csv_delicious,1,2026-03-08T04:42:07.286Z,2026-04-12T17:43:39.806Z,,,,,,,"[""digital""]",,,,,,,0,0,false,
1256,SpongeBob SquarePants: The Battle for Bikini Bottom,game,SpongeBob SquarePants: The Battle for Bikini Bottom - PlayStation 2,,2014,Digital,,THQ,,,,movie,https://www.igdb.com/games/2-games-in-1-spongebob-squarepants-battle-for-bikini-bottom-plus-spongebob-squarepants-supersponge,https://images.igdb.com/igdb/image/upload/t_cover_big/coahig.jpg,,A compilation of two SpongeBob SquarePants games on a single cartridge.,,,0752919460375,,Edition: Standard | Platform: PlayStation 2,,,,,"{""platform"":""PlayStation 2"",""developer"":""THQ""}",,1,7,csv_delicious,1,2026-03-08T04:59:30.901Z,2026-04-06T06:35:42.527Z,,,,,,,"[""digital""]",,,,,,,0,0,false,
887,Spy Hunter,game,Spy Hunter - Gamecube,1983-11-01T00:00:00.000Z,2020,Digital,"Shooter, Racing, Arcade",Nintendo,,,,movie,https://www.igdb.com/games/spy-hunter,https://images.igdb.com/igdb/image/upload/t_cover_big/co6owb.jpg,,"Originating in the arcades, Spy Hunter is a driving action game played from an overhead point of view. Your car is equipped with machine guns to help you get past the numerous enemies out on the road (be careful not to shoot any civilians, though!) Occasionally you will come across a weapons van, and if you drive into the back of the van your car becomes equipped with a second weapon (such as smoke screen, oil slick, or missiles). At several points the road splits and you can enter a boathouse which transforms your car into a boat temporarily. If you drive far enough the seasons change as well (watch out for icy conditions during winter!). The enemy cars will do anything to stop you, including running you off the road, firing guns from the back of a limo, or dropping bombs from a helicopter.",,,0031719198573,,Edition: Standard | Platform: Nintendo GameCube,,,,,"{""platform"":""Nintendo GameCube"",""developer"":""Coleco""}",,1,7,csv_delicious,1,2026-03-08T04:52:53.262Z,2026-04-06T06:35:42.527Z,,,,,,,"[""digital""]",,,,,,,0,0,false,
