id,title,media_type,original_title,release_date,year,format,genre,director,rating,user_rating,tmdb_id,tmdb_media_type,tmdb_url,poster_path,backdrop_path,overview,trailer_url,runtime,upc,location,notes,season_number,episode_number,episode_title,network,type_details,series_id,space_id,library_id,import_source,added_by,created_at,updated_at,signed_by,signed_role,signed_on,signed_at,signed_proof_path,cast_members,owned_formats,estimated_value_low,estimated_value_mid,estimated_value_high,valuation_currency,valuation_source,valuation_last_updated,tv_season_count,tv_completed_season_count,tv_all_seasons_completed,cast
7547,Action Girlz Racing,game,Action Girlz Racing - Nintendo Wii,2008-01-16T00:00:00.000Z,2008,Digital,Racing,Conspiracy,,,,movie,https://www.igdb.com/games/action-girlz-racing,https://images.igdb.com/igdb/image/upload/t_cover_big/co4ahz.jpg,,"Action Girlz Racing puts you in the driving seat in a completely new and wonderful way! For the first time ever you can pick your favorite Action Girl and take to the roads to race around fairy-tale castles, holiday resorts and even through school corridors while the teachers aren't looking! Best of all are the Action Girlz themselves. Meet Kat, an action girl with no fear - she will take anything on! Latisha is so cool you have to check her for a pulse - nothing riles this girl! Bianca is all about being a professional - she has it all! The 'Action Girlz' are here, so grab your lipstick, start your engines and get ready to race!",,,0815315000542,,Edition: Standard | Platform: Nintendo Wii,,,,,"{""platform"":""Nintendo Wii"",""developer"":""Data Design Interactive""}",,1,7,csv_delicious,1,2026-04-12T17:46:37.925Z,2026-04-12T17:46:37.925Z,,,,,,,"[""digital""]",,,,,,,0,0,false,
7550,Agents of Mayhem,game,Agents of Mayhem - PlayStation 4,2017-08-15T00:00:00.000Z,2017,Digital,"Shooter, Adventure",Deep Silver,,,,movie,https://www.igdb.com/games/agents-of-mayhem,https://images.igdb.com/igdb/image/upload/t_cover_big/co22mh.jpg,,"Agents of Mayhem is the new open world game from Volition, the studio that brought you the Saints Row franchise. Play as a cast of unique and diverse Super Agents from all over the world, and lead them in MAYHEM’s epic fight to save the city of Seoul from the destructive schemes of the evil supervillain organization LEGION!",,,0816819013625,,Edition: Standard | Platform: PlayStation 4,,,,,"{""platform"":""PlayStation 4"",""developer"":""Deep Silver""}",,1,7,csv_delicious,1,2026-04-12T17:47:00.533Z,2026-04-12T17:47:00.533Z,,,,,,,"[""digital""]",,,,,,,0,0,false,
7497,Alita: Battle Angel Limited Edition Steelbook,game,,2019-02-25T00:00:00.000Z,2019,Blu-ray,"Role-playing (RPG), Hack and slash/Beat 'em up",AantnaSR,,,,movie,https://www.igdb.com/games/alita-battle-angel-the-game,https://images.igdb.com/igdb/image/upload/t_cover_big/co84n0.jpg,,"Under the shadow of the last great city in the sky, prepare to set off through the streets of Iron City and get ready for an epic adventure six-hundred years in the making…

Alita: Battle Angel - The Game is the official game based on the all-new theatrical film produced by James Cameron and Jon Landau and directed by Robert Rodriguez. It’s a high-octane cyberpunk MMORPG mobile game that allows players to experience all the action, emotion, locations, weapons, and characters from the movie!

Lost in the labyrinthine streets of Iron City, join forces with the heroine Alita, cyborg jacker Hugo and their friends in an effort to stop the power-hungry forces of The Factory.

Alita: Battle Angel – The Game provides both PvE and PVP game modes alongside an innovative gameplay narrative told within the story of the Alita movie! Enhance your character with cyborg upgrades, gather your crew and hit the streets – Alita: Battle Angel – The Game is waiting!

Features:
PVE and PVP Gameplay
- Face a variety of challenges, and gameplay modes from the movie.

Personalized Outfits
- Choose from numerous weapons, gear and cybernetic upgrades to customize the look of your player character.

Powerful Hunter Warriors
- Hunter Warriors are the police and bounty hunters of Iron City and can be hired to assist you in battle. Team up and choose your tactics wisely so you can bring down the mightiest enemies.

Stunning graphics and special effects
- With stunning, high-quality action and graphics – this game is built to showcase the incredible detail, depth and scale of the world of Alita Battle Angel.

As Alita would say — “Do not stand by, in the presence of Evil!” Join players around the world as you prepare for the battle of your lives!",,,0024543632177,,Edition: Limited Edition,,,,,"{""platform"":""Android, iOS"",""developer"":""FoxNext Games""}",,1,7,csv_delicious,1,2026-04-12T17:26:18.173Z,2026-04-12T17:42:49.256Z,,,,,,,[],,,,,,,0,0,false,
7498,All Star Baseball 2004,game,,2003-02-28T00:00:00.000Z,2003,Digital,"Simulator, Sport",Acclaim,,,,movie,https://www.igdb.com/games/all-star-baseball-2004,https://images.igdb.com/igdb/image/upload/t_cover_big/co6dlj.jpg,,"The 2004 installment in Acclaim's long-running baseball series. The game features more than 80 new features and improvements, including a deeper, more customizable franchise mode. The biggest change comes in the interface. You still hit the same buttons to swing, bunt, steal, and field, but the batting cursor has been visually altered. It's still the same triangle shape as before, just with a different outline. Bunting is more unique, though. Instead of aiming the cursor when you go to bunt, a large arrow points on the ground. Aim your bunt in the desired direction and hope for the best. Fielding has also received a slight change, with the ball cursor changing color. Four up to four players.",,,0021481403128,,Edition: Standard | Platform: Xbox,,,,,"{""platform"":""Xbox"",""developer"":""Acclaim Studios Austin""}",,1,7,csv_delicious,1,2026-04-12T17:26:20.940Z,2026-04-12T17:42:54.545Z,,,,,,,"[""digital""]",,,,,,,0,0,false,
7543,American Idol,game,,2003-11-07T00:00:00.000Z,2020,Digital,Music,Codemasters,,,,movie,https://www.igdb.com/games/american-idol,https://images.igdb.com/igdb/image/upload/t_cover_big/co25b8.jpg,,"Complete with a computer generated Randy Jackson, Paula Abdul, and Simon Cowell, with trademark insults, American Idol is a music-based, rhythm-action game that will allow you to create, style, and train a contestant for the competition. Once styled and trained you'll see your contestant progress through the auditions, various heats, and then, hopefully, make it to the grand final. You'll need quick fingers as you match the right combination of buttons to what's displayed on the screen helping your contestant sing a sweet harmony and dance to the rhythm of the song. Get it wrong and your voice fades and goes out of tune as the judges and later the audience grow unsettled.",,,,,Edition: Standard,,,,,"{""platform"":""PC (Microsoft Windows), PlayStation 2"",""developer"":""Mobius Entertainment""}",,1,7,csv_delicious,1,2026-04-12T17:46:30.819Z,2026-04-12T17:46:30.819Z,,,,,,,"[""digital""]",,,,,,,0,0,false,
7554,Anthem,game,Anthem - PlayStation 4,2019-02-22T00:00:00.000Z,2023,Digital,"Shooter, Role-playing (RPG), Adventure",Electronic Arts,,,,movie,https://www.igdb.com/games/anthem,https://images.igdb.com/igdb/image/upload/t_cover_big/co2n94.jpg,,"Anthem is a shared-world action RPG, where players can delve into a vast landscape teeming with amazing technology and forgotten treasures. This is a world where Freelancers are called upon to defeat savage beasts, ruthless marauders, and forces plotting to conquer humanity.",,,0014633369960,,Edition: Standard | Platform: PlayStation 4,,,,,"{""platform"":""PlayStation 4"",""developer"":""Electronic Arts""}",,1,7,csv_delicious,1,2026-04-12T17:47:26.706Z,2026-04-12T17:47:26.706Z,,,,,,,"[""digital""]",,,,,,,0,0,false,
7480,Army Men Sarges War - Gamecube,game,Army Men Sarges War - Gamecube,2007-03-26T00:00:00.000Z,2007,Digital,Shooter,2K,,,,movie,https://www.igdb.com/games/army-men-sarge-s-war,https://images.igdb.com/igdb/image/upload/t_cover_big/co45jc.jpg,,"Army Men: Sarge's War is a 2004 game in the Army Men video game series. It was initially developed by series creator The 3DO Company but after that company's bankruptcy was purchased and completed by Global Star Software. The game is more mature and darker than earlier games in the series. Sarge makes no comical moves, holes are blown into soldiers, and the weapons are also made of metal.",,,0710425245480,,Platform: Nintendo GameCube,,,,,"{""platform"":""Nintendo GameCube"",""developer"":""Global Star Software""}",,1,7,csv_delicious,1,2026-04-12T17:25:19.711Z,2026-04-12T17:42:09.517Z,,,,,,,"[""digital""]",,,,,,,0,0,false,
7555,Army of Two: Platinum Hits,game,Army of Two: Platinum Hits - Xbox 360,2008-03-05T00:00:00.000Z,2008,Digital,"Shooter, Tactical",Electronic Arts,,,,movie,https://www.igdb.com/games/army-of-two,https://images.igdb.com/igdb/image/upload/t_cover_big/co5x88.jpg,,"Army Of Two throws gamers into hot spots ripped from current day headlines where they will utilize unique two-man strategies and tactics while seamlessly transitioning between playing with intelligent Partner AI (PAI) and a live player. When one man is not enough, it will take an army of two to fight through war, political turmoil and a conspiracy so vast it threatens the entire world",,,0014633157512,,Edition: Standard | Platform: Xbox 360,,,,,"{""platform"":""Xbox 360"",""developer"":""EA Montreal""}",,1,7,csv_delicious,1,2026-04-12T17:47:28.917Z,2026-04-12T17:47:28.917Z,,,,,,,"[""digital""]",,,,,,,0,0,false,
7556,Army of Two: The 40th Day,game,Army of Two: The 40th Day - Xbox 360,2010-01-12T00:00:00.000Z,2010,Digital,"Shooter, Tactical",Electronic Arts,,,,movie,https://www.igdb.com/games/army-of-two-the-40th-day,https://images.igdb.com/igdb/image/upload/t_cover_big/co2n8d.jpg,,"The wild boys of the SSC face hell again in this sequel to the hit third-person teamwork-based shooter. Army of Two: The 40th Day reunites Salem and Rios as they're forced to survive in a city under siege. The sequel includes more co-op moves for players to use at any time, which will allow for completely different strategies and options in battle, adding up to a bigger, more organic and immersive co-op experience.

The story of The 40th Day places Salem and Rios in the middle of Shanghai, China, as a disaster of epic proportions strikes the city. While they happen to be in the wrong place at the wrong time, they are the right men to react to the chaos. As they fight their way through ruined districts of the city, they discover more and more catastrophes are being orchestrated to devastate Shanghai piece by piece. It's up two Salem and Rios to uncover the secret of the 40th Day and survive the chaos.",,,0014633193794,,Edition: Standard | Platform: Xbox 360,,,,,"{""platform"":""Xbox 360"",""developer"":""Electronic Arts""}",,1,7,csv_delicious,1,2026-04-12T17:47:30.019Z,2026-04-12T17:47:30.019Z,,,,,,,"[""digital""]",,,,,,,0,0,false,
7557,Battlefield 2 Modern Combat,game,Battlefield 2 Modern Combat - Xbox,2005-10-24T00:00:00.000Z,2005,Digital,Shooter,Electronic Arts,,,,movie,https://www.igdb.com/games/battlefield-2-modern-combat,https://images.igdb.com/igdb/image/upload/t_cover_big/co1ot4.jpg,,Battlefield 2: Modern Combat is the fourth installment in the Battlefield Series and was developed by DICE and published by EA. It is a console spin-off of the critically acclaimed Battlefield 2 for the PC.,,,0014633148589,,Edition: Standard | Platform: Xbox,,,,,"{""platform"":""Xbox"",""developer"":""Electronic Arts""}",,1,7,csv_delicious,1,2026-04-12T17:47:31.120Z,2026-04-12T17:47:31.120Z,,,,,,,"[""digital""]",,,,,,,0,0,false,
7558,Battlefield 2042,game,Battlefield 2042 - PlayStation 4,2021-11-19T00:00:00.000Z,2023,Digital,Shooter,Electronic Arts,,,,movie,https://www.igdb.com/games/battlefield-2042,https://images.igdb.com/igdb/image/upload/t_cover_big/co7dfn.jpg,,"Battlefield 2042 marks the return to the iconic all-out warfare of the franchise. Adapt and overcome dynamically-changing battlegrounds with the help of your squad and a cutting-edge arsenal. With support for 128 players, prepare for unprecedented scale on vast environments. Take on massive experiences, from updated multiplayer modes like Conquest and Breakthrough to the all-new Hazard Zone.",,,0014633374483,,Edition: Standard | Platform: PlayStation 4,,,,,"{""platform"":""PlayStation 4"",""developer"":""Electronic Arts""}",,1,7,csv_delicious,1,2026-04-12T17:47:32.317Z,2026-04-12T17:47:32.317Z,,,,,,,"[""digital""]",,,,,,,0,0,false,
7559,Battlefield Bad Company 2 Ultimate Edition,game,Battlefield Bad Company 2 Ultimate Edition - Playstation 3,2010-07-31T00:00:00.000Z,2010,Digital,Shooter,Electronic Arts,,,,movie,https://www.igdb.com/games/battlefield-bad-company-2-ultimate-edition,https://images.igdb.com/igdb/image/upload/t_cover_big/co80rw.jpg,,"The game is primarily a squad-level first-person shooter based in a contemporary modern warfare setting. Additionally, the game includes a single-player campaign, where the player re-assumes the role of Preston Marlowe, the protagonist of the original game. The game's Frostbite 1.5 engine allows for destructible environments. Multiplayer maps, which allow for five different game modes, contain a wide selection of vehicles, aircraft and emplacements",,,0014633195491,,Edition: Ultimate | Platform: PlayStation 3,,,,,"{""platform"":""PlayStation 3"",""developer"":""Electronic Arts""}",,1,7,csv_delicious,1,2026-04-12T17:47:33.329Z,2026-04-12T17:47:33.329Z,,,,,,,"[""digital""]",,,,,,,0,0,false,
7560,Battlefield Hardline,game,Battlefield Hardline - PlayStation 4,2015-03-17T00:00:00.000Z,2015,Digital,Shooter,Electronic Arts,,,,movie,https://www.igdb.com/games/battlefield-hardline,https://images.igdb.com/igdb/image/upload/t_cover_big/co1nmg.jpg,,"Battlefield: Hardline features a whole new variety of gameplay that breaks away from the traditional Battlefield game modes. The new game modes are Heist Mode, Rescue Mode, Hotwire Mode and Bloodmoney Mode. The focus of the game has been shifted to police rather than the millitary background that has spanned the whole series up to now. Players will have access to various millitary grade weapons and vehicles as well as having police equipment such as tasers and handcuffs.",,,0014633732740,,Edition: Standard | Platform: PlayStation 4,,,,,"{""platform"":""PlayStation 4"",""developer"":""Visceral Games""}",,1,7,csv_delicious,1,2026-04-12T17:47:34.436Z,2026-04-12T17:47:34.436Z,,,,,,,"[""digital""]",,,,,,,0,0,false,
7510,Beautiful Katamari - Xbox 360,game,Beautiful Katamari - Xbox 360,2007-10-15T00:00:00.000Z,2007,Digital,"Puzzle, Adventure",BANDAI NAMCO Entertainment,,,,movie,https://www.igdb.com/games/beautiful-katamari,https://images.igdb.com/igdb/image/upload/t_cover_big/co48qa.jpg,,"Experience the new high-definition, next generation sights and sounds of Beautiful Katamari as the Prince takes on a new high-rolling adventure, with his famous cousins in tow, to save the Katamari universe once again after the King of All Cosmos has a very un-royal and unfortunate accident. As usual, the King of All Cosmos demands the service of his son, the Prince, to roll anything and everything up into massive clumps and set things right, bringing harmony once again to the Katamari Cosmos. To keep his son inspired, the King of All Cosmos will provide another fresh and memorable soundtrack that will have players moving and grooving to the beat as they roll through the absurd, yet wonderful world of Beautiful Katamari.",,,0722674210072,,Edition: Standard | Platform: Xbox 360,,,,,"{""platform"":""Xbox 360"",""developer"":""Bandai Namco Entertainment""}",,1,7,csv_delicious,1,2026-04-12T17:28:27.962Z,2026-04-12T17:44:20.734Z,,,,,,,"[""digital""]",,,,,,,0,0,false,
7503,Bee Movie Game - PlayStation 2,game,Bee Movie Game - PlayStation 2,2007-10-30T00:00:00.000Z,2007,Digital,Adventure,ACTIVISION,,,,movie,https://www.igdb.com/games/bee-movie-game--2,https://images.igdb.com/igdb/image/upload/t_cover_big/coank7.jpg,,,,,0047875830851,,Edition: Standard | Platform: PlayStation 2,,,,,"{""platform"":""PlayStation 2"",""developer"":""Activision""}",,1,7,csv_delicious,1,2026-04-12T17:26:38.643Z,2026-04-12T17:43:06.631Z,,,,,,,"[""digital""]",,,,,,,0,0,false,
7530,Beverly Hills Cop,game,,1990-12-31T00:00:00.000Z,2020,Digital,"Racing, Arcade",Blast,,,,movie,https://www.igdb.com/games/beverly-hills-cop,https://images.igdb.com/igdb/image/upload/t_cover_big/co9ctn.jpg,,"Beverly Hills Cop is a video game developed by Tynesoft and published in 1990. The story is loosely based on the 1984 film Beverly Hills Cop. The player controls Axel Foley in four distinct sub-games: a side-scrolling action game, a driving game, an overhead view shooter, and a first person shooter. The game was released on Commodore 64, ZX Spectrum, BBC Micro, Amstrad CPC, Amiga, Atari ST, and MS-DOS. The BBC version only contains the driving game.",,,,,Platform: PlayStation 2,,,,,"{""platform"":""PlayStation 2"",""developer"":""Tynesoft""}",,1,7,csv_delicious,1,2026-04-12T17:45:21.937Z,2026-04-12T17:45:21.937Z,,,,,,,"[""digital""]",,,,,,,0,0,false,
7590,Biker Mice From Mars,game,Biker Mice From Mars - PlayStation 2,2007-06-01T00:00:00.000Z,2007,Digital,"Hack and slash/Beat 'em up, Arcade",Game Factory,,,,movie,https://www.igdb.com/games/biker-mice-from-mars--2,https://images.igdb.com/igdb/image/upload/t_cover_big/co3zgb.jpg,,"The Biker Mice from Mars are on a quest to get hold of the one thing that can save Mars, their home planet, from total destruction – the Regenerator, but they are not the only ones who want this powerful item – Hairball, leader of the ruthless feline race ""the Catatonians"", and Ronald Rump, evil corporate land developer want the Regenerator for their own evil purposes. They will throw everything they have at our heroes to acquire it, but the Biker Mice are not alone – they have friends throughout the solar system to help them when the going gets rough. It's an action-packed struggle that starts on Earth and culminates on the planet Mars, with the fate of both planets hanging in the balance! Play the role of each of the three popular Biker Mice: Throttle, the cool leader, Vinnie, the fun dare-devil, or Modo the gentle giant. Throughout each challenge, General Carbine is in touch with the Biker Mice to communicate the mission objectives. Charley the mechanic will also help by repairing their bikes, inventing new weapons and gadgets, and instructing the heroes on how to use them.",,,0855433001557,,Edition: Standard | Platform: PlayStation 2,,,,,"{""platform"":""PlayStation 2"",""developer"":""Creat Studios""}",,1,7,csv_delicious,1,2026-04-12T17:49:14.464Z,2026-04-12T17:49:14.464Z,,,,,,,"[""digital""]",,,,,,,0,0,false,
7481,Bioshock - Xbox 360,game,Bioshock - Xbox 360,2007-08-21T00:00:00.000Z,2007,Digital,"Shooter, Puzzle, Role-playing (RPG), Adventure",2K,,,,movie,https://www.igdb.com/games/bioshock,https://images.igdb.com/igdb/image/upload/t_cover_big/co2mli.jpg,,"BioShock is a horror-themed first-person shooter set in a steampunk underwater dystopia. The player is urged to turn everything into a weapon: biologically modifying their own body with Plasmids, hacking devices and systems, upgrading their weapons, crafting new ammo variants, and experimenting with different battle techniques are all possible. The game is described by the developers as a spiritual successor to their previous PC title System Shock 2. BioShock received high praise in critical reviews for its atmospheric audio and visual quality, absorbing and original plot and its unique gaming experience.",,,0710425392191,,Edition: Standard | Platform: Xbox 360,,,,,"{""platform"":""Xbox 360"",""developer"":""Demiurge Studios""}",,1,7,csv_delicious,1,2026-04-12T17:25:21.840Z,2026-04-12T17:42:10.622Z,,,,,,,"[""digital""]",,,,,,,0,0,false,
7482,Bioshock 2 - Xbox 360,game,Bioshock 2 - Xbox 360,2010-01-31T00:00:00.000Z,2010,Digital,"Shooter, Puzzle, Role-playing (RPG), Adventure",2K,,,,movie,https://www.igdb.com/games/bioshock-2,https://images.igdb.com/igdb/image/upload/t_cover_big/co2mlj.jpg,,"BioShock 2 is the second game of the BioShock series and the sequel to BioShock. It continues the grand storyline of the underwater metropolis Rapture. BioShock 2 capitalizes and improves upon the high-quality effects, unique gameplay elements, and immersive atmosphere that defined the first game. It explores more brutal gameplay than its predecessor, with new enemies, weapons, Plasmids, and Gene Tonics.",,,4560181803792,,Edition: Standard | Platform: Xbox 360,,,,,"{""platform"":""Xbox 360"",""developer"":""2K Games""}",,1,7,csv_delicious,1,2026-04-12T17:25:24.221Z,2026-04-12T17:42:11.650Z,,,,,,,"[""digital""]",,,,,,,0,0,false,
7561,Black,game,Black - Xbox,2006-02-28T00:00:00.000Z,2006,Digital,"Puzzle, Indie",Electronic Arts,,,,movie,https://www.igdb.com/games/black--1,https://images.igdb.com/igdb/image/upload/t_cover_big/co5btl.jpg,,The sequel to my 'yellow' and 'red' games is here! Can you make the screen black in 50 levels? Each level has its own logic.,,,0014633151046,,Edition: Standard | Platform: Xbox,,,,,"{""platform"":""Xbox"",""developer"":""Bart Bonte""}",,1,7,csv_delicious,1,2026-04-12T17:47:35.656Z,2026-04-12T17:47:36.728Z,,,,,,,"[""digital""]",,,,,,,0,0,false,
7562,Boom Blox,game,Boom Blox - Nintendo Wii,2008-05-01T00:00:00.000Z,2008,Digital,"Music, Puzzle",Electronic Arts,,,,movie,https://www.igdb.com/games/boom-blox,https://images.igdb.com/igdb/image/upload/t_cover_big/co86zg.jpg,,"Boom Blox is a action puzzle game developed in conjunction with Steven Spielberg. The objective of Boom Blox is to keep a structure made of blocks from being knocked down or to knock over a structure using the Wii Remote to throw, shoot or grab colorful character-based blocks through 300 levels through five worlds.

The game utilizes a realistic physics-based system. Depending on how a projectile is thrown and at what angle, the blocks will react accordingly, and collapse based on the real-time action.",,,0014633155471,,Edition: Standard | Platform: Nintendo Wii,,,,,"{""platform"":""Nintendo Wii"",""developer"":""Electronic Arts""}",,1,7,csv_delicious,1,2026-04-12T17:47:37.741Z,2026-04-12T17:47:37.741Z,,,,,,,"[""digital""]",,,,,,,0,0,false,
7483,Borderlands - Xbox 360,game,Borderlands - Xbox 360,2009-09-30T00:00:00.000Z,2009,Digital,"Shooter, Role-playing (RPG)",2K,,,,movie,https://www.igdb.com/games/borderlands,https://images.igdb.com/igdb/image/upload/t_cover_big/co20tx.jpg,,"With its addictive action, frantic first-person shooter combat, massive arsenal of weaponry, RPG elements and four-player co-op, Borderlands is a breakthrough experience that challenges all the conventions of modern shooters. Borderlands places you in the role of a mercenary on the lawless and desolate planet of Pandora, hell-bent on finding a legendary stockpile of powerful alien technology known as The Vault.

Role Playing Shooter (RPS) - combines frantic first-person shooting action with accessible role-playing character progression.

Co-Op Frenzy - Fly solo in single player or drop in and out with up to 4 Player Co-Op online for a maniacal multiplayer experience.

Bazillions of Guns - Gun lust fulfilled with rocket-launching shotguns, enemy-torching revolvers, SMGs that fire lightning rounds, and tons more.

Radical Art Style - New visual style combines traditional rendering techniques with hand-drawn textures to create a unique and eye-catching spin on the First Person genre.

Intense Vehicular Combat - Get behind the wheel and engage in intense vehicle-to-vehicle combat.",,,0710425397257,,Edition: Standard | Platform: Xbox 360,,,,,"{""platform"":""Xbox 360"",""developer"":""2K Games""}",,1,7,csv_delicious,1,2026-04-12T17:25:26.255Z,2026-04-12T17:42:12.848Z,,,,,,,"[""digital""]",,,,,,,0,0,false,
7484,Borderlands 2 Deluxe Vault Hunter's Edition -Xbox 360,game,Borderlands 2 Deluxe Vault Hunter's Edition -Xbox 360,2012-09-18T00:00:00.000Z,2012,Digital,Shooter,2K,,,,movie,https://www.igdb.com/games/borderlands-2-deluxe-vault-hunters-edition,https://images.igdb.com/igdb/image/upload/t_cover_big/co80s6.jpg,,"Gearbox sends gamers back to the Borderlands for a shooter-adventure sequel of high-velocity combat and custom character development. The first-person action plays out in dystopian outpost environments on the original game's planet of Pandora, five years later, as a greedy industrialist called Handsome Jack seeks to weed out the local populace through a series of gladiator matches. Players choose from four new character types, each with three branches of specialized development in the game's RPG-like experience system. Experience comes with kills and quest completions.

Expanding on the original game, Borderlands 2's gun system can create millions of different computer-generated weapons, as well as shields and equipment enhancements. Non-player characters are more expressive, and quest outcomes have more influence on the game world. In addition to the dusty, desert settings of the first adventure, the sequel visits a number of new Pandora environments, including the merciless frozen tundra where the revenge-driven plotline begins. Online, over a local network, or in split screen, the game's co-op mode allows a second player to freely join and drop out of a game in session.

The ""Deluxe Vault Hunter's Collectors Edition"" offers players the full game, an authentic Marcus Kincaid bobblehead doll, a hardbound art book, a set of four collectible stickers, a map of Pandora, and DLC including a digital comic.",,,7104254918180,,Edition: Deluxe Vault Hunter | Platform: Xbox 360,,,,,"{""platform"":""Xbox 360"",""developer"":""Gearbox Software""}",,1,7,csv_delicious,1,2026-04-12T17:25:28.452Z,2026-04-12T17:42:13.855Z,,,,,,,"[""digital""]",,,,,,,0,0,false,
